atmosphere,city,cleanliness,country,description,distance,facilities,kind,location,name,price,rating,rating_cat,reviews,security,services,staff,value_for_money
,Ubud,,Indonesia,"Attractively situated in the Ubud City-Centre district of Ubud, Aurora House is situated 300 m from Ubud Market, 300 m from Ubud Palace and 1.3 km from Ubud Monkey Forest. The property has a garden, as well as a terrace. The property is 300 m from the city middle. The rooms at the guest house are fitted with a seating area. All rooms are equipped with a private bathroom with free toiletries, while some feature garden views. An Asian breakfast is available every morning at the property. Elephant Cave is 3.2 km from Aurora House, while Ary's Warung is 100 m from the property. The nearest airport is Ngurah Rai International Airport, 28 km from the accommodation. This is our guests' favorite part of Ubud, according to independent reviews. This property also has one of the best-rated locations in Ubud! Guests are happier about it compared to other properties in the area. Terms and Conditions: Free Cancellation:1 Days before the arrival without being charged by the property Check in from 13:00 Check out Before 12:00 Payment on Arrival:Cash Only Reception working hours: 24 hours Tax included Breakfast not included guests should be quiet after 24:00 No pets Smoking Allowed  View House Rules  ",1.2,,Hotel,,Aurora House Ubud,US$20.94,,No Rating,1,,"Free Internet Access, Free Parking, Free WiFi, Towels Included, Air Conditioning, Cable TV, Hair Dryers For Hire, Airport Transfers, Housekeeping, Internet Access, Laundry Facilities, Reception (limited hours), Room service (limited hours), Wi-Fi",,
,Ubud,,Indonesia,"Ubud Ubud is a village in Gianyar regency 1 our away from Denpasar and really famous because of their art and culture, located amongst rice paddies and hills with the famous ayung ricer and wos river. Promoted as an arts and culture center, it has develop a large tourism industry. Tourism on the island develop after thearrival of Walter Spies and ethnic German born in Russia who taught painting and music and dabbled in dance. Ubud has a lot of tourism destination such as Puri Saren in Puri Ubud, Traditional art Market, Monkey Forest and Art Museum. The house compound: Traditionally, the Balinese compound appears to lack the adequate provision for sleeping, eating and bathing of the modern Western culture. All buildings within a Balinese compound lack wall; in the most basic house compound, the only pavilion building that is enclosed with walls is the pavilion where the head of the family sleeps. The rest of the family member sleep in an open pavilion. Pavilions are often wall-less, erected over a low plinth, and surmounted by a clay pantiles or thatched roof, which is supported by a timber or bamboo frame depending on wealth of the owner. The wall, if erected, only constitutes a screen to provide privacy and not a load-bearing structure. Each building in a house compound is identified with a certain cardinal direction, body organ, color and deity; depending on its placement. When a son of the family marries, his wife usually moves into his compound, so a compound is frequently a place for extended families, each with their own sleeping quarters, but otherwise sharing the facilities. Domestic activities take place outside or in the pavilion. Traditionally there is no bathing facility in a Balinese compound as people take their bath in public bathing pools. Central courtyard The central courtyard (natah), located in the center, is identified metaphorically with the navel. It is basically a packed earth central courtyard which is always kept free of vegetation except for a few ornamental flowers or decorative kamboja trees.[1] It is the symbolic center of the domestic microcosm. Family Shrine The family shrine is the most sacred area of the compound, located in the most auspicious northeast (kaja-kangin) corner of a Balinese house compound. It is identified metaphorically with the head.[1] The area of the family shrine is always enclosed within a sacred enclosure (pamerajan). Inside the family shrine area are shrines dedicated to various Hindu gods (e.g. Surya, Saraswati), nature spirits (Sridevi, Ibu Pertiwi), and family ancestors.[5] The most important shrines is the sanggah kemulan, a shrine containing three compartments dedicated to the Hindu trimurti of Brahma, Vishnu and Shiva. The sanggah kemulan is a simple, house-like, wooden structure raised on pillars and standing on a column made of brick or sandstone. Sanggah kemulan is naturally located on the most sacred corner of the family shrine compound, the kaja-kangin corner. In Balinese Hindu religion, Brahma is also associated with male ancestors of the household, while Vishnu is with female ancestors. When a Balinese man marries, he should build one of these shrines.[5]} The family shrine area is not the only place for shrines. Other shrines, e.g. the sanggah pengijeng karang ('house-protecting shrine'), is traditionally positioned in the northwest (kaja-kauh) side of the house compound, to the west of the main pavilion. Pavilions Balinese pavilions (bale) can be identified with rooms in the western-style houses: each pavilion has its own different function. The Balinese people classified the pavilions according to the number of posts used in their construction. A four-posts pavilion is known as bale sakepat (Balinese 'four-post pavilion'), a six-posts is known as bale sakenam ('six-post pavilion'), and so on. The Balinese also classified the pavilion according to its position within the compound: a pavilion in the east (kangin) side of the compound is known as bale dangin ('east pavilion'), and so on. The most important pavilion in a Balinese house compound is the pavilion of the head of the household, known as bale daja ('north pavilion'), because it is located on the north (kaja) side of the house compound. It is also known as bale meten (Balinese 'sleeping pavilion'). The pavilion is the main sleeping room of the head of the household. It is often the only enclosed or walled pavilion within the house compound, and so it is also used to store family heirlooms. Bale daja is also the only pavilion with pointed roof, others being hip-roofed; a pointed roof is usually associated with sacred structure and is also used in the family shrines structure. Being the only place where privacy is available, the bale daja can be used for the newly weds; during the occasion, the head of the family will may move out temporarily. Other pavilions in a Balinese house compound are bale sakepat ('four post pavilion') or bale dangin ('east pavilion'), a pavilion with four posts and located in the east side of the house compound. Bale sakepat is traditionally reserved for the head of the other extended families living in the compound (usually brothers) or for holding important ceremonies (e.g. marriage or tooth-filing).[7] The pavilion for receiving guests, the bale tiang sanga ('nine post pavilion') or bale dauh ('west pavilion'), is situated in the west (kauh) side of the compound. The bale sakenam ('six post pavilion') or bale delod ('south pavilion') is located at the southern (kelod) end of the courtyard; a utilitarian pavilion which is traditionally used for women to do their weaving. Utilitarian structures The kitchen (paon), rice barn (lumbung) and sometimes a pigsty is identified with the legs and feet. The kitchen is typically situated in the southern end of the courtyard, the hearth is identified with sexual organs. The kitchen is usually the simplest structure in a Balinese compound. A kitchen usually employs a gable roof which is relatively easier than hip roof construction. The lumbung on the other hand is the most elaborate structure in a Balinese compound. Similar with other region in Indonesia, a lumbung is associated with goddess of rice Sridevi. A Balinese lumbung is basically a rice storage made of wooden deck raised high off the ground on posts that stand on foundation stones rather than a masonry plinth. Often a wooden platform is built below the rice storage, providing a shaded workplace by day and a sleeping deck at night. The design of the roof of a lumbung vary place to place; to the majority southern Balinese employs a hull-shaped thatched roof with horseshoe-shaped gable ends for their lumbung. This distinctive lumbung roof has been replicated for many bungalow resorts in Bali.[8] House gates The house gate (lawang) – the entrance to a compound – is ideally placed at the most inauspicious side of the compound, usually in the west wall towards the south end (kauh-kelod). It is identified with the anus. Sometimes this entrance is flanked with gate shrines (apit lawang). A small screen wall (aling-aling) is built directly behind the opening, screening off the interior and preventing evil spirits to enter the house compound. These house gates can be constructed with a simple alang-alang grass thatch or heavily ornate, the degree of elaboration reflects the economic status of the owner of the house. Hierarchy of a house compound Balinese Hinduism is strongly influenced by the caste system and ranks; this in turn affected the Balinese domestic architecture. There are four divisions in Balinese society: three noble caste (collectively named triwangsa) and the common man (shudra). The triwangsa is subdivided into royalty and warriors (satriya), priests (brahmana), and merchants (wesia).[9] The caste of the common man is entitled for the most basic type of a house compound: the pekarangan ('enclosure'). The pekarangan contains all the basic components: the sleeping pavilion (bale meten or daja), the other pavilions for mundane activities, a rice barn, and a kitchen; all are arranged around an open courtyard (natah). Family shrine is always positioned in the most auspicious corner at the north-east (kaja-kangin).[9] The residential compound of nobler triwangsa caste is built using the same principle as the common man's but with more complex proportion and decoration. The simplest type is the jero, which is very similar to the pekarangan with its single courtyard, although more elaborate. The main difference between the triwangsa caste with the common man is that the triwangsa is allowed to erect a bale gede ('grand pavilion'), a large pavilion supported by 12 posts and used for entertaining guests[1] or for important family rites of passage.[10] Another type of pavilion allowed for this caste is the bale dwaja ('standard/flag pavilion'), traditionally reserved for members of the satriya caste; and the bale lembu-gajah ('cow-elephant pavilion') traditionally reserved for Hindu or Buddhist priest. Other bale allowed for this caste is the bale bengong ('contemplating pavilion'), an pleasure pavilion used for resting or chatting. A Brahman who becomes a priest (pedanda) is entitled to a larger residence, called griya. Similarly, royal families are entitled a puri ('palace'). Both griya and puri consist of multiple courtyards instead of single courtyard. These multiple courtyards, similarly surrounded by pavilions, create its own subdivision within the extensive house compound. Each subdivision follows the same importance, and so the subdivision located in the kaja-kangin direction is always the most auspicious where the most important of the family shrines are usually located. In a royal palace, each courtyard compound corresponds to a specific use relating to royal duties. Despite the complexity of a griya or a puri, spatial orientation and hierarchical organization principle remains the same: the kaja-kangin is always the most auspicious corner. Principally, the consistent spatial orientation and hierarchy of Balinese traditional houses, whether it is the most lavish or the most humblest, are harmoniously linked with each other.[4] Nick’s Homestay Nick's Homestay is a peaceful oasis in the heart of busy Ubud, only 5 minutes walk from Monkey Forest and 15 minutes walk from Ubud Center or Ubud Traditional Market, restaurant and shopping center An ideally stay with a Balinese Family compound in the hearth of Ubud. The homestay design in the houses of Balinesse holy priest. Please feel your stay with Balinese Family and be a part of them.Our Family welcomes guests from all over the world. We look forward to making you feel at home in Ubud and sharing with us our culture with you. After pampering yourself in one of your rooms, you may proceed with a daily walk to the Ubud area. Pool access is available to Nicks Pension or Nick Hidden Cottages at no additional cost. Simple and attractive are the two words that describe the rooms of the Nick's Homestay Hotel, Bali almost perfectly. This is because at this hotel you will get to choose among some plain yet comfortable rooms. The rooms are categorized into single and double rooms, Smoking rooms and non-smoking rooms. They are sure to appeal to travelers of all kind. Adding to this is the lovely decor of the room's interior. Together with some of the most facilities amenities they fill the rooms with ample comfort. Room information We have 11 comfortable rooms, each with hot water, ceiling fan are available for guest and shady terrace where you can enjoy our complimentary breakfast and tea every morning. We hope you will also enjoy our lush garden and the many gorgeous song birds. We have 2 types of rooms: 1.Standard Room we have 5 rooms Consist of choice 1 double bed Standard room feature with private bath room, and fan.  Wheater located on the ground , the Standard room offer a green beautiful garden and stay with in one of Balinese house compound. Other feature are includes dressing table, wardrobe, and complimentary morning tea every day. 2. Superior Rooom we have 6 rooms. Consist of choice 1 double bed ( 2 rooms )  or twin bed ( 2 rooms   ) or Triple bed ( double & single bed ) also 2 rooms.. We also can fit an extra mattress inside. Superior room feature with private bath room, with bath tub, fan and air conditioning.  Wheater located on the ground or top  floor with private balcony, the Superior room offer a green beautiful garden view.Other feature are includes dressing table, wardrobe, and two complimentary morning tea every day. Our room rate: •Standard Fan at 270,000 rupiah •Superior AC at 400,000 rupiah •Superior Triple at 450,000 rupiah •Extra mattress at 100,000 rupiah All the rate are inclusive breakfast at 21% government and service charge Airport pick up at 375,000 rupiah Location Located at Jalan Hanoman No.57 Ubud, only 5 minutes walk to Monkey forest and 15 minutes to Ubud center. The Nick's Homestay Hotel, Bali is placed in one of the most sought after regions of Bali. It is located in the Padang Tegal Kelod of the lovely town of Ubud. This is one place from where you can experience Bali at its best. You can enjoy a holiday minus its commercialization, hustle-bustle and commotion. This is because here you will be accompanied by quite a picturesque and peaceful surrounding. The spots of interest around it include the Monkey Forest, Botanic Garden, Museum Puri Lukisan, shopping arcades, beaches and so on. Thus the Nick's Homestay Hotel in Bali will surely make available a one of a kind experience. Transport is also available on a frequent basis around the hotel thus making your excursions around Ubud even more easier. Facilities. Room with hot and cold shower Ceiling Fan Air conditioning in Superior room Free swim nearby at Nick's Pension or Nick's Hidden Cottages Daily morning tea Tour desk. 24 hours doctor on call. Laundry Service Massage Service Rent push / motor bike. Airport transfer Shuttle bus Let's spend your holiday with a memorable one, with Our Tourist Information with their daily activities such us: * Daily excursion program ( private / sharing ) * Down hill Cycling Tour. * Sunrise Trekking at Mountt Batur * White water rafting on Ayung river / Telagawaja River * Daily Performance in Ubud areas. * Cooking Class at some restaurant in Ubud. * And many other things you can do upon you stay with us. For any inquiries, information or special offer to be assistance, please feel free to contact us  View House Rules  ",2.1,,Hostel,,Nick's Homestay,US$9.00,,No Rating,264,,"Free Breakfast, Free Parking, Free WiFi, Linen Included, Towels Included, Air Conditioning, Bicycle Parking, Card Phones, Ceiling Fan, Hot Showers, Parking, 24 Hour Reception, Airport Transfers, Bicycle Hire, Fax Service, Housekeeping, Internet Access, Late check-out, Laundry Facilities, Luggage Storage, Postal Service, Reception (limited hours), Tours/Travel Desk, Meals Available, Restaurant, Tea & Coffee Making Facilities",,
9.4,Ubud,8.6,Indonesia,"Shiva House features Balinese architecture surrounded by greenery. A 5-minute walk from Ubud Palace, it provides free WiFi access throughout its premises. The sacred Monkey Forest is a 10-minute drive from Shiva House, while Ngurah Rai International Airport is a 1.5-hour drive away. Offering garden views from the private terraces, rooms are fitted with a wardrobe and tiled flooring. The private bathroom comes with bath and shower facilities. Airport transfers and area shuttles can be arranged on site. Breakfast is delivered to guests' rooms every morning.  View House Rules  ",1.7,8.9,Hostel,8.6,Shiva House Ubud,US$10.57,9.2,Superb,14,9.4,"Free Breakfast, Free WiFi, Linen Included, Towels Included, Bicycle Parking, Ceiling Fan, Hot Showers, Outdoor Terrace, Airport Transfers, Housekeeping, Laundry Facilities, Tours/Travel Desk, Tea & Coffee Making Facilities",10.0,9.7
6.3,Ubud,7.3,Indonesia,"Located in the lovely area of Ubud, Dewa Hostel enjoys a commanding position in the spas, culture, sightseeing hub of Bali. From here, guests can enjoy easy access to all that the lively city has to offer. With its convenient location, the hotel offers easy access to the city's must-see destinations. Dewa Hostel also offers many facilities to enrich your stay in Bali. The hotel provides 24-hour room service, free Wi-Fi in all rooms, 24-hour security, daily housekeeping, taxi service to ensure our guests the greatest comfort. Guests can choose from 1 rooms, all of which exude an atmosphere of total peace and harmony. Besides, the hotel's host of recreational offerings ensures you have plenty to do during your stay. Whatever your reason for visiting Bali, the Dewa Hostel is the perfect venue for an exhilarating and exciting break away.  View House Rules  ",1.4,6.8,Hostel,9.3,Dewa Hostel,US$5.62,7.6,Very Good,40,7.0,"Free Breakfast, Free City Maps, Free Internet Access, Free WiFi, Air Conditioning, Book Exchange, Card Phones, Common Room, Cooker, Fridge/Freezer, Iron / Ironing Board, Outdoor Terrace, Reading Light, Safe Deposit Box, Security Lockers, 24 Hour Reception, 24 Hour Security, Airport Transfers, Housekeeping, Internet Access, Late check-out, Luggage Storage, Reception (limited hours), Shuttle Bus, Tours/Travel Desk, Towels for hire, Cafe, Restaurant, Foosball",8.0,8.8
8.0,Ubud,7.0,Indonesia,"Teba House Bisma Ubud is a comfortable guesthouse in the heart of Ubud - Bali. Teba House Bisma Ubud offers budget accommodation at a cheap price, within walking distance of most places of interest in Ubud and approximately one hour's drive from Denpasar Ngurah Rai International Airport. We are one of the cheapest and most comfortable guest houses to stay at in Bisma area Ubud, with beautiful ricefield surrounding,  you will find yourself living in tranquility as our rooms nestled in our lush back yard. Here you will enjoy spacious rooms with  with free Wifi,cold and hot water, fan, and private balcony overlooking to our lush garden. More facilities, such as Air conditioning and bath-tub in our Deluxe rooms. We are also surrounded by many western and local restaurants,bars and shops yet we are in a quiet area of Ubud.  View House Rules  ",2.2,8.0,Bed and Breakfast,8.0,Teba House Bisma Ubud,US$4.96,8.6,Fabulous,13,9.0,"Free WiFi, Towels Included, Air Conditioning, Bicycle Parking, Book Exchange, Cable TV, Card Phones, Ceiling Fan, Hot Showers, Hot Tub, Outdoor Terrace, Parking, Reading Light, 24 Hour Security, Bicycle Hire, Housekeeping, Late check-out, Luggage Storage, Reception (limited hours), Tours/Travel Desk, Tea & Coffee Making Facilities",10.0,10.0
4.0,Ubud,6.0,Indonesia,"Halaman Depan Hostel offers a classic balinese style hostel that offers clean, comfortable and affordable accommodations. Halaman Depan Hostel offers dormitory style accommodations, and each room is equipped with air conditioning, private locker, shared bathrooms, hot and cold shower. Featuring shared kitchen facilities, internet station, and a living area with comfortable bean beds and nice garden view, guests also can enjoy a meal or drinks at the communal area or gazebo. The Hostel also provides airport transfer, car/bike hire and shuttle services with an additional charge.  View House Rules  ",3.1,4.0,Hostel,2.0,Halaman Depan Hostel Ubud,US$2.64,4.6,Rating,78,6.0,"Free Internet Access, Free Parking, Free WiFi, Linen Included, Adaptors, Air Conditioning, Card Phones, Common Room, Cooker, Dishwasher, Elevator, Fridge/Freezer, Hot Showers, Hot Tub, Key Card Access, Outdoor Terrace, Parking, Reading Light, Safe Deposit Box, Security Lockers, Self-Catering Facilities, 24 Hour Reception, 24 Hour Security, Airport Transfers, ATM, Bicycle Hire, Housekeeping, Internet Access, Late check-out, Laundry Facilities, Luggage Storage, Reception (limited hours), Tours/Travel Desk, Wake-up calls, Cafe, Meals Available, Mini-Supermarket, Restaurant, Tea & Coffee Making Facilities, Foosball",4.0,6.0
6.0,Ubud,10.0,Indonesia,"Nirwa Homestay is located in a peaceful oasis in the beautiful ricefields of Ubud. It is ideal for the single traveller, couple or small family who would prefer home-style accommodation with a real Balinese family, rather than typical, undistinguished motel facilities.  View House Rules  ",1.1,6.0,Bed and Breakfast,8.0,Nirwa Ubud Homestay,US$1.04,6.9,Good,73,6.0,"Free Breakfast, Free City Maps, Free Internet Access, Free WiFi, Linen Included, Towels Included, Bicycle Parking, Ceiling Fan, Hot Showers, Outdoor Swimming Pool, Outdoor Terrace, Reading Light, 24 Hour Reception, 24 Hour Security, Airport Transfers, Express check-in / out, Housekeeping, Internet Access, Laundry Facilities, Luggage Storage, Tours/Travel Desk, Tea & Coffee Making Facilities, Wi-Fi",6.0,6.0
,Ubud,,Indonesia,"Dewangga Bungalow offers a peaceful retreat amidst lush tropical gardens, a 3-minute walk from Ubud Palace. Featuring an art gallery, outdoor pool and a restaurant, it provides sightseeing arrangements, Tai Chi and cooking classes. Wi-Fi access is free throughout. The sacred Monkey Forest is a 5-minute stroll from Dewangga Bungalow, while Ngurah Rai International Airport is 2 hours’ drive away. Various dining options are within walking distance of the property. Cooled by a fan or air conditioning, each Balinese-style room has a seating area, writing desk and a wardrobe. Guests can lounge on the private terrace or balcony while enjoying views of the greenery. Free toiletries are provided in the en suite bathrooms. Day trips, car and bicycle rental can be arranged at the tour desk. Leisurely afternoons can be spent playing a game of billiards or taking a stroll through the landscaped gardens. Operating a 24-hour front desk.  View House Rules  ",1.5,,Hotel,,Dewangga Bungalow,US$15.86,,No Rating,1,,"Free Breakfast, Free Internet Access, Free Parking, Free WiFi, Towels Included, Air Conditioning, Ceiling Fan, Cots Available, Hair Dryers, Hot Showers, Hot Tub, Outdoor Swimming Pool, Outdoor Terrace, Parking, Swimming Pool, 24 Hour Reception, 24 Hour Security, Airport Transfers, Bicycle Hire, Housekeeping, Internet Access, Laundry Facilities, Luggage Storage, Tours/Travel Desk, Bar, Café, Meals Available, Restaurant, Pool Table",,
