atmosphere,city,cleanliness,country,description,distance,facilities,kind,location,name,price,rating,rating_cat,reviews,security,services,staff,value_for_money
7.9,Kuala Lumpur,8.0,Malaysia,"Beaming in the centre of Kuala Lumpur’s vibrant Chinatown, Reggae Mansion is widely known as No.1 Party Hostel in KL - Home during the day, Party Playground after dark.Although surrounded by towering buildings and skyscrapers in the city, colonial style buildings which are scarce these days always invoke a sense of nostalgia, both to locals and visitors. Happily, those nostalgic feelings are now captured by Reggae Mansion KL. With its colonial charm unspoiled, reminiscent to the days gone by. Reggae Mansion KL is located in the heart of bustling China Town in a beautifully renovated 3-storey building. Options of rooms ranging from capsule-style rooms, private rooms and suites. Our funky Reggae Rooftop is known to set the entire town’s party mood. Offering a spectacular view of Petronas Twin Towers and KL Tower, your night will be an unforgettable one. Equipped with BBQ area, affordable booze and an awesome line up of DJs each night. We have so much to offer, you will never want to leave. Reggae Mansion is located in a prime area. 5 minutes walk to Chinatown, Petaling Street, 2 minutes to the nearest LRT station Masjid Jamek LRT, 15 minutes walk to Petronas Tower & KL Tower. Reggae Mansion is surrounded by few convenience stores like 7 Eleven & Times. Famous fast food chain like McDonalds, Burger King & KFC is just a walk away. Things to Note: Effective 1 July 2017, if the guests opt to pay by credit or debit card, all payment CARD transactions will need to be verified by PIN and signature will no longer be accepted as per mandated by Bank Negara Malaysia. Please be advised that effective September 2017 Tourism Tax will be imposed to all foreign tourist. Sales & Service Tax (SST) which is to be implemented as of 1 September 2018 for the supply of several goods and services. As a hotel or leisure accommodation, we are identified as being taxable under this new tax at 6%. Please note that the prices of the four-, six- and eight-bed dorms are the same. Please be reminded that if you book into these dorms, management reserves the right to change your bookings from four- to six or eight bed dorms and vice versa. This is to ensure that we have the flexibility to make sure all of our guests' requests are fulfilled. If you are travelling in a group, we cannot guarantee that your group will be staying in the same dorm. However, we will try our best to arrange it so that you do stay in the same dorm together. But sometimes, due to circumstances beyond our control, this is not always possible. Request for lower bunk is only first come first serve basis. Our hostel is not wheelchair accessible as we have no lift. This is a backpacker and a party music hostel. We only accept guests under the age of 50. NOTE: Guest failure to arrive on the stated arrival time without notifying your booking will be cancelled within 5 hours.  View House Rules  ",unknown,8.7,Hostel,8.8,Reggae Mansion Kuala Lumpur,US$8.99,8.6,Fabulous,5622,9.2,"Free Breakfast, Free City Maps, Free Internet Access, Free Parking, Free WiFi, Linen Included, Towels Included, Adaptors, Air Conditioning, BBQ, Bicycle Parking, Book Exchange, Cable TV, Ceiling Fan, Common Room, Dryer, Fridge/Freezer, Hair Dryers, Hair Dryers For Hire, Hot Showers, Iron / Ironing Board, Outdoor Terrace, Parking, Reading Light, Safe Deposit Box, Security Lockers, Utensils, Washing Machine, 24 Hour Reception, 24 Hour Security, Airport Transfers, Housekeeping, Internet Access, Laundry Facilities, Luggage Storage, Tours/Travel Desk, Wake-up calls, Bar, Cafe, Meals Available, Restaurant, Foosball, Nightclub, Pool Table, Wi-Fi",9.1,8.3
8.3,Kuala Lumpur,8.9,Malaysia,"NEWLY opened in February 2019 Malaysia’s No.1 hostel with the Best SKYLINE VIEW 8 reasons why you should stay here! 1) Superb SKYLINE view The hostel is located at level 26, which is the top floor of a high rise building in the heart of the city. The unit covers 4100 square feet ( 370 square meter ) of space, as it is a grand duplex PENTHOUSE unit with a breathtaking city view of Kuala Lumpur. The view speaks for itself! 2) Spacious common area The total common area size is more than 1500 square feet ( 140 square meter ) and this is bigger than any typical grandma’s house size. You can lay on the floor, wooden chairs, swinging chair, sofa chairs or anywhere you want all day long. Every spot in the common area allows you to enjoy the superb KL Twin Tower view. Moreover, you can find a pool table, a ping pong table ( table tennis ), board games, mini games & darts at your arm’s reach. The most important thing is all of these wonderful leisure facilities are FREE OF CHARGE! 3) Free drinks We serve the best filtered drinking water ( hot / cold ) from COWAY, which is the No.1 leading brand in both Korea and Malaysia in the water industry. The ice water is cooler than your ex-boy/girl friend's hearts, which is perfect for Malaysia’s tropical hot climate. Are you a coffee lover? Or you just simply can’t go through the day without caffeine in your veins? If your answer is YES for either, just stay here and you can enjoy our local coffee 24/7 for free! 4) 24 hours security & front desk assistance The building has a comprehensive 3-tier security surveillance system to ensure your safety at all times. Security personnel are always available at the main lobby, and in addition, security guards patrol the whole premises and CCTV surveillance cameras monitor 24 hours daily. Our front desk is running 24/7 as well. Hence, you could check in to OHANA anytime of the day or get assistance from us without any hassle! 5) Comfy Mattress The mattresses we provide to our guests are made from celliant fabric, an imported advance technology from the USA. Celliant fabric is made from mineral crystals which enhances blood circulation, improves the immune system and the body's overall performance. The size of every mattress is 11 inches in height and it’s combined together with the comforter for a night’s sound sleep. Therefore, we truly understand if you accidentally overslept and end up late to check out. Just kindly inform us to extend your stay for another night. 6) The incredible room design The design of our bunk bed is inspired by the Japanese Bunk. The bunk is build by imported Indonesia plywood and every bunk size is 32 square feet ( 3 square meter ). Every area inside the bunk, regardless of the top, bottom or the side are all full covered by poly foam materials for better sound proof. There is also a built-in mini fan, a study light, USB ports, personal curtain and locker too. The difference between a traditional mixed dorm setup and our bunk bed is the level of privacy, the sound proof effect and the spacious room size. The total space size of all the rooms is 2000 square feet ( 183 square meter ) ensuited with 8 toilets. 7) Stone thrown distance to public transport The public transport is very convenient as the Imbi Monorail station is just within 4 minutes walking distance. We are located within the most happening area of Kuala Lumpur - Bukit Bintang. You can easily get wonderful local food, relaxing massages, a variety of shopping malls and spectacular night life in the capital city of Malaysia. 8) Ultra-fast and stable Wi-Fi We are using the fastest and strongest Wi-Fi in town with download and upload speed up to 100 Mbps and  60 Mbps respectively. It is accessible both from the rooms and common areas. We challenge you that you hardly get this kind of Wi-Fi in most of the guesthouse. ***Property Policies & Conditions: 1. Cancellation Policy: 3 days before arrival. 2. Check in time: after 1500 (3PM) 3. Check out time: before 1200 (12PM) 4. Payment upon arrival by cash or credit card. 5. Taxes: included 6. Breakfast: included 7. No curfew. 8. No smoking in rooms, but smoking area is provided. 9. Reception Operation Hours: 24 / 7 (24 hours per day, 7 days per week) 10. Age Restriction: above 16 years old.  View House Rules  ",unknown,8.8,Hostel,8.5,OHANA Kuala Lumpur,US$4.06,8.8,Fabulous,307,9.2,"Free Breakfast, Free City Maps, Free Internet Access, Free WiFi, Linen Included, Air Conditioning, Book Exchange, Cable TV, Ceiling Fan, Fitness Centre, Hair Dryers, Hot Showers, Indoor Swimming Pool, Iron / Ironing Board, Microwave, Reading Light, Sauna, Security Lockers, Swimming Pool, 24 Hour Reception, 24 Hour Security, Housekeeping, Internet Access, Laundry Facilities, Luggage Storage, Towels for hire, Tea & Coffee Making Facilities, Board Games, PlayStation, Pool Table, Wi-Fi",8.6,9.3
9.1,Kuala Lumpur,9.4,Malaysia,"Our simple, family-run bed and breakfast is conveniently located in the 'Heart of the Heart' of exciting Kuala Lumpur, along the famous Bukit Bintang Walk. Being newly renovated, Sunshine Beds is proud to boast of its new modern chic design, cleanliness and economically savvy rates! Breakfast consists of toast and coffee/tea. Across the road is the ever popular LOT 10 shopping mall, the Sungei Wang shopping mall. Just slightly further along the road (say a ten minute walk) is the infamous Low Yatt Electronic/Digital Haven Mall and just behind that is Berjaya Times Square (the only mall in Malaysia with a roller coaster in it!). And if you are keen on enjoying a beer or say dancing the night away, the glorious Changkat district of clubs, wine bars, restaurants, and cafes is just a three minutes walk. In addition to that, just downstairs there is a Watsons Pharmacy/Convenience store, a clinic, Money changers, McDonalds, and a police station just in front of that. But most importantly, the BUKIT BINTANG MONORAIL Train Station is literally a two minute walk from Sunshine Beds doorstep! The monorail can take you from Chinatown, to the KL Twin Towers (Suria KLCC), and even the Kuala Lumpur International Airport (KLIA). We will within reasonable means strive to provide a comfortable and memorable stay with us. We hope to see you soon.  View House Rules  ",unknown,8.7,Hostel,9.8,Sunshine Bedz KL,US$7.37,9.3,Superb,8461,9.4,"Free Breakfast, Free City Maps, Free Internet Access, Free WiFi, Linen Included, Towels Included, Adaptors, Air Conditioning, Book Exchange, Common Room, Hair Dryers, Hot Showers, Reading Light, Security Lockers, 24 Hour Reception, 24 Hour Security, Internet Access, Luggage Storage, Tea & Coffee Making Facilities, Vending Machines, Wi-Fi",9.6,9.3
9.0,Kuala Lumpur,9.4,Malaysia,"KL Skyline & Rooftop Infinity Sky Pool is one to write home about. Take in the spectacular views of the Petronas tower and KL city or sink back into one of the lounge areas to take in the sun. Make the outdoor space at Skyline on 34 your own secret slice of skylights. As well as from your Room have amazing night and sun rise view. KL skyline offer spacious sky lounge with spectacular views, meet other travelers in our sky lounge, equipped with huge terrace lobby facing the Kuala Lumpur city with 180* angle. KL Skyline situated in one the Poshe building of Kuala Lumpur, Regalia Residence , Building Complete with high-end amenities, including a fitness center, Library Wall tennis, cafe, mini Market, so on! and top pick, a Breath-taking view of Kuala Lumpur from Rooftop Infinity Skypool on 37th Floor of the building. Roomand Facilities, Mingle in our mixed en-suite dorms, where you'll find Solid bunks with privacy curtains and reading lights, rooms come with extra space, including free bath products, Linen, Air con, High Speed WiFi, Huge lock next your bed, Game area with 65-inch Smart TV, Weekend Chilled out Session, Our Kitchen feature. Hostel is located near to The Putra World Trade Centre or PWTC, which is synonymous with UMNO to most locals. Hostel is just few minutes away from  PWTC LRT Train Station and Sunway Putra Mall. our rooms are spacious, air conditioned, Living Room with a large screen TV (which was popular most evenings) also will have Weekend PS 4 Game Session. All bunks are equipped with private curtains, Reading  LED Lights, Universal Plug sockets, Private cabinet and comfy Beds and Lines, High speed WiFi . Meet up with fellow travelers,  at our Sky lounge at top level 34, Its place ultra modern, cool vibes, Instagrammable destination  with huge terrace lobby ? common area which provide Netflix & chill & Meet people, Playing games, last but not least a dedicated activity team who set up activities day and into the evening including buffet / food tour. ***Property Policies & Conditions: 1. Cancellation Policy: 2 day before arrival. 2. Check in from 15:00 to 23:00.(Late Check in Please  let us know Earlier) 3. Check out before 12:00. 4. Payment upon arrival by cash/credit card. 5. Taxes: not included. - Extra 6% will be added as SST. 6. Breakfast: not included. 7. No curfew. 8. No smoking in rooms, but designated area is provided. 9. Reception Working Hours: from 07:00 to 2:00.(For after 10PM Check in please inform us in advance)  View House Rules  ",unknown,9.4,Hostel,8.8,KL Skyline & Rooftop Infinity Sky Pool,US$5.91,9.3,Superb,513,9.5,"Free City Maps, Free Internet Access, Free WiFi, Linen Included, Adaptors, Air Conditioning, Card Phones, Cooker, Cots Available, Elevator, Fitness Centre, Fridge/Freezer, Hair Dryers, Iron / Ironing Board, Outdoor Terrace, Reading Light, Security Lockers, Steam Room, Swimming Pool, 24 Hour Reception, 24 Hour Security, Airport Transfers, Housekeeping, Internet Access, Late check-out, Reception (limited hours), Cafe, Tea & Coffee Making Facilities, PlayStation, Wi-Fi",9.3,9.4
,Kuala Lumpur,,Malaysia,"Starpoints Hotel Kuala Lumpur is a Platinum Award Winning hotel in Kuala Lumpur. Starpoints Hotel Kuala Lumpur located in the midst of a bustling city center, close proximity to most of the attractions. Starpoints Hotel Kuala Lumpur offers a variety of shopping and food options within walking distance. Personalized service at an affordable price is our priority. Starpoints Hotel Kuala Lumpur offers Nonsmoking public areas, all rooms nonsmoking with Standard room (17 sqm) to Suite room (50 sqm), equipped with air-conditioning and hot shower, wifi available throughout the property. The street is popular for Gold and diamonds shops. The hotel has a tour desk that can assist in organizing local/intercity tours. Terms & Conditions Cancellation policy: 3 days before arrival. In case of a late cancellation or No Show, you will be charged the first night of your stay. Check in from 14:00 to 23:00 . Check out before 12:00 . 24 hours reception. Taxes not included - occupancy tax 10 MYR per room per night Breakfast not included. No curfew. Child friendly. Non smoking except for specific areas. Property may pre-authorize the credit card before arrival.  View House Rules  ",unknown,,Hotel,,Starpoints Hotel Kuala Lumpur,US$16.22,,No Rating,0,,"Free Internet Access, Free WiFi, Linen Included, Towels Included, Air Conditioning, Breakfast Not Included, Elevator, Fridge/Freezer, Hair Dryers, Hot Showers, Iron / Ironing Board, Key Card Access, Meeting Rooms, Parking, Reading Light, Safe Deposit Box, 24 Hour Reception, 24 Hour Security, Fax Service, Housekeeping, Laundry Facilities, Room service (limited hours), Tours/Travel Desk, Wake-up calls, Meals Available, Mini-Supermarket, Restaurant, Wi-Fi",,
,Kuala Lumpur,,Malaysia,"Guests will find all of the finest amenities in each of the 15 rooms in this popular Guest House. Each room includes air conditioning, desk, non smoking rooms. This excellent hotel in Kuala Lumpur also has laundry service/dry cleaning, safety deposit boxes, 24hr room service, Wi-Fi in public areas. Strategically located in the heart of Kuala Lumpur city, our neighbors include Central Market, Petaling Streer(Chinatown), Dataran Merdeka(Independence Square), KL Tower, KLCC, National Museum, major shopping malls and significant historical sites. Our building has been gazetted by the Malaysian governement as a herritage site and the main structure has been preserved. Within walking distance, you could easily walk to banks, money changers, grocery stores, bus stops, taxi stands, train stations. With its commitment to service and focus on hospitality, you\'ll enjoy your stay at Submarine Guest House. Making a booking at Submarine Guest House Kuala Lumpur is easy with our secure online form; just enter your dates and click.  View House Rules  ",unknown,,Bed and Breakfast,,Submarine Guest House,US$5.41,,No Rating,17,,"Free Internet Access, Free WiFi, Linen Included, Air Conditioning, Ceiling Fan, Fridge/Freezer, Hot Showers, Microwave, Safe Deposit Box, Self-Catering Facilities, Towels Not Included, 24 Hour Reception, 24 Hour Security, Airport Transfers, Currency Exchange, Internet Access, Luggage Storage, Towels for hire, Wi-Fi",,
,Kuala Lumpur,,Malaysia,"Sun Inns Hotel Kepong Manjalara is a great place situated a stone's throw away from affluent neighborhoods such as Taman Tun Dr Ismail , Desa Park City , Bandar Utama, Damansara Perdana, Kepong,and Sungai Buloh. Sun Inns Hotel Kepong along with a 24-hour front desk, this hotel has free newspapers and tour/ticket assistance. WiFi in public areas is free. All rooms offer complimentary wireless Internet access, fitted with tiled flooring, the air-conditioned rooms feature a flat-screen TV with satellite channels and private hot shower. Hot and cold drinking water is available along the hotel corridors. ***Property Policies & Conditions: 1. The guest can cancel free of charge until 1 day before arrival. The guest will be charged the first night if they cancel within 1 day before arrival or No-Show. 2. Check in from after 1400 hour. 3. Check out before 12 noon. 4. Payment upon arrival by Cash, Credit Card or Debit Card. 5. Taxes Included (10% Service Charge & 6% Government Tax). 6. Non smoking room are available. 7. Age restriction: 18+. 8. Reception working hours 24 hours.  View House Rules  ",unknown,,Hotel,,Sun Inns Hotel Kepong,US$9.93,,No Rating,0,,"Free WiFi, Towels Included, Air Conditioning, Breakfast Not Included, Cable TV, Ceiling Fan, Cots Available, Hot Showers, Parking, 24 Hour Reception, Housekeeping, Luggage Storage",,
,Kuala Lumpur,,Malaysia,"Citin Seacare Pudu Hotel is a newly renovated hotel located in the shopping and entertainment district of Kuala Lumpur. The hotel is within a short walk to Petaling Street, also known as Chinatown. Endowed with an unbeatable location, it is merely 5 minutes away from Bukit Bintang, one of the most lively and vibrant districts of Kuala Lumpur. The Star LRT station, also a few minutes away, is a convenient source of transportation within the city. Citin Seacare Pudu Hotel has been newly renovated with new comfortable beds, new bed sheets, new pillows and new bathroom amenities. Moreover, the hotel’s lobby and Citin Café have also been improved to ensure that our guests enjoy fine and intimate dining with a relaxing ambiance. Citin Seacare Pudu Hotel now offers three room types: the Superior, Deluxe and Premier room. All the rooms include the comforts and amenites of standard quality such as a 32” LED TV with satellite TV channels, WiFi internet, minibar, coffee/tea making facilities, built-in international adaptor, personal electronic safe, electronic boiler and an ensuite bathroom.  View House Rules  ",unknown,,Hotel,,Citin Seacare Pudu Hotel,US$11.47,,No Rating,11,,"Free Internet Access, Air Conditioning, Elevator, Hot Showers, Parking, Safe Deposit Box, Wheelchair Friendly, 24 Hour Reception, Currency Exchange, Fax Service, Housekeeping, Internet Access, Laundry Facilities, Tours/Travel Desk, Bar, Restaurant",,
,Kuala Lumpur,,Malaysia,"The Tamu Hotel & Suites, Kuala Lumpur is an urban oasis located on the historically steeped intersection. The commanding location of this four-star business class hotel in Kampong Bharu puts Kuala Lumpur’s best local attractions, historical sites, shopping, dining and entertainment both at your doorsteps or a mere 5 – 10 minutes away by car. Tamu Hotel & Suites is conveniently located just minutes away from the towering Kuala Lumpur City Centre (KLCC Twin Towers), Bukit Bintang, Jalan Tunku Abdul Rahman and Pavilion. At TAMU Hotel & Suites where simplicity meets contemporary that will inspire our guests. Personalized and genuine service, we extend you our ‘Selamat Datang’. We have an array of celebrated and sought after culinary delights that captivate and serenade even the most demanding of gourmands. ***Property Policies & Conditions: 1. Cancellation policy: At least 3 days advance notice for free cancellation. 2. Check in from 14:00 to 23:00. 3. Check out before 12:00 noon. 4. Payment upon arrival by cash and Card. 5. NO smoking in Room, but have smoking area. 6. Reception working hours 24 hours. 7. Taxes not included. ** 6% Sales Services Tax (SST) is not included in online rates. ** A tourist tax of RM 10 per room (ONLY FOR PRIVATE ROOMS) per night is applied to all foreign guests. This tax is not included in the room rate and must be paid upon check-in. Guests with a valid Malaysian Identity Card or valid permanent residents MY PR Card are exempted. 8. The property will collect a miscellaneous deposit of RM100nett per night and the miscellaneous deposit will be refund full amount upon check-out, should guest does not have any additional charges in their room bill.  View House Rules  ",unknown,,Hotel,,Tamu Hotel & Suites Kuala Lumpur,US$30.70,,No Rating,0,,"Free City Maps, Free Internet Access, Free Parking, Free WiFi, Towels Included, Air Conditioning, Breakfast Not Included, Cable TV, Card Phones, Cots Available, Dryer, Fitness Centre, Hair Dryers, Hot Tub, Indoor Swimming Pool, Iron / Ironing Board, Key Card Access, Meeting Rooms, Outdoor Terrace, Parking, Safe Deposit Box, Swimming Pool, Wheelchair Friendly, 24 Hour Reception, 24 Hour Security, Business Centre, Housekeeping, Late check-out, Laundry Facilities, Luggage Storage, Postal Service, Reception (limited hours), Wake-up calls, Bar, Meals Available, Minibar, Restaurant, Tea & Coffee Making Facilities",,
,Kuala Lumpur,,Malaysia,"Soft lighting, soothing and gentle furnishing and décor with Victorian ambiance in Hotel Rae provide perfect relaxation in the Hotel's 48 simply exotic hotel rooms.  All rooms are fully installed with contemporary amenity and equipment to ensure you a relaxing stay with us. Ideally adjacent to and within walking distance to the bustling and renowned shopping malls, entertainment and dining outlets, retails, commercial and business enterprises in Bukit Bintang – Malaysia's premier lifestyle shopping paradise.  View House Rules  ",unknown,,Hotel,,Hotel Rae,US$12.51,,No Rating,1,,"Free City Maps, Free WiFi, Air Conditioning, Breakfast Not Included, Cable TV, Key Card Access, Parking, Safe Deposit Box, 24 Hour Reception, 24 Hour Security, Housekeeping, Internet Access, Luggage Storage, Tours/Travel Desk, Restaurant, Tea & Coffee Making Facilities, DVD's",,
,Kuala Lumpur,,Malaysia,"Metro Hotel Bukit Bintang is located  in the heart of the lively city of Kuala Lumpur and perfectly walking distance to mall major hot spots, up market restaurants, bar and shopping malls (Berjaya Time Square, Bukit Bintang Shopping Belt, KL Twin Tower, China Town) and for those who would like to explore KL more the Imbi train station is just a stone throws away. Metro Hotel is souly designed with a touch of contemporary to cater for holidaymakers looking for comfortable ambience and style.and also not to forget the function rooms for those who are planning to embrace their business talks, seminars and also private parties. All our rooms are desinged with only one things in mind to provide maximum comfort and convenience, elegantly decorated to suit our guests.  View House Rules  ",unknown,,Hotel,,Metro Hotel Bukit Bintang,US$19.58,,No Rating,2,,"Free Internet Access, Air Conditioning, Cable TV, Elevator, Meeting Rooms, Parking, Safe Deposit Box, 24 Hour Reception, 24 Hour Security, Airport Transfers, Housekeeping, Luggage Storage, Tours/Travel Desk, Restaurant, Tea & Coffee Making Facilities",,
,Kuala Lumpur,,Malaysia,"Set within 1 km of The Weld, Hawk Hotel & Hostel in Kuala Lumpur provides an ample sized room with free WiFi. The property is located 1.8 km from Dinner in the Sky KL and 2.1 km from Petronas Twin Towers. The property is 2.3 km from Starhill Gallery. The room include a private bathroom, air conditioning and  individual lockers. Pavilion Kuala Lumpur is 2.3 km from the accommodation. Sultan Abdul Aziz Shah Airport is 30 km from the property. Located just 260 m from Masjid Jamek LRT Station and 500m from Pudu Sentral Bus Station (Airport Shuttle available), Hawk Hotel & Hostel offers accommodations in the heart of Kuala Lumpur. Free WiFi is available throughout the property. Terms and Conditions: Free Cancellation:3 Days before the arrival,otherwise being charged by the property Check in from 2pm Check out Before 12pm Payment on Arrival: Cash and Credit Card Tax is not included in the room price. Private Room and dorm room prices are subject to 6% SST. If  you book with the Private Rooms, You will also need to pay Tourism Tax as well, which is RM10, by per room per night basis. This amount will be collected upon check in. The total amount to be collected will solely base on how many room(s) and night(s) they guest booked, and it will only applied to foreigners. Malaysian and MyKad (IC) holders will be exempted. BreakfastIncluded No Smoking in the whole hostel Reception working period/time:7:00 - 22:30 Pet Not Friendly  View House Rules  ",unknown,,Hostel,,Hawk Hotel & Hostel,US$7.30,,No Rating,0,,"Free Breakfast, Free Parking, Free WiFi, Towels Included, Air Conditioning, Cable TV, Ceiling Fan, Hair Dryers, Hot Showers, Microwave, 24 Hour Security, Housekeeping, Reception (limited hours), Tea & Coffee Making Facilities, Wi-Fi",,
