atmosphere,city,cleanliness,country,description,distance,facilities,kind,location,name,price,rating,rating_cat,reviews,security,services,staff,value_for_money
8.0,Langkawi,8.0,Malaysia,"As Langkawi’s 1st capsule hotel, Modular Langkawi Capsule Hotel provides a chic, affordable sleep in a cool, minimalist ambience. All 30 capsules are equipped with modern features for your convenience without the expensive price tag of a hotel room. To meet the needs of different travelers, we provide the option of single and double occupancy (coming soon!) capsules as well as Female-Only Dorm for the privacy of our female guests. Our amenities include free Wi-Fi, spacious lounge area, secure lockers & luggage room, separate men & women toilets as well as showers with toiletries (shampoo and shower gel) and towels. With Langkawi International Airport a mere 5-minute drive away, we are conveniently located to ensure you have a comfortable base to explore all of the 99 beautiful tropical islands of Langkawi on Malaysia’s West Coast, powdery white sand beaches, lush jungles, duty free shopping and other top attractions for an unforgettable adventurous holiday! ***Property Policies & Conditions: 1. Cancellation Policy: All the bookings are non-refundable, no cancellation, no changes. You will be charged the full balance after the booking is made. 2. Check in from 14:00 to 23:30. 3. Check out before 12:00 (noon). 4. Payment upon arrival by cash or credit card. 5. Taxes: not included. - Hotel guests are required to pay RM1 in cash during check in for each capsule booking per night in accordance to Langkawi City of Tourism requirement. 6. Breakfast: not included. 7. Age Restriction: For safety reasons, children under the age of 18 cannot be accommodated at the hostel. 8. Please take note that we do not provide extra beds. 9. No curfew. 10. No smoking in the whole hostel. 11. Pets are not allowed.  View House Rules  ",unknown,6.0,Hotel,6.0,Modular Langkawi Capsule Hotel,US$15.06,7.7,Very Good,5,8.0,"Free Parking, Free WiFi, Linen Included, Towels Included, Adaptors, Air Conditioning, Breakfast Not Included, Hair Dryers, Hot Showers, Iron / Ironing Board, Key Card Access, Parking, Reading Light, Safe Deposit Box, Security Lockers, Housekeeping, Luggage Storage, Reception (limited hours), Vending Machines, Wi-Fi",8.0,10.0
6.7,Langkawi,6.0,Malaysia,"Ideally located in the heart of Kuah Town, Langkawi. Clover Guesthouse is close to the Jetty and Eagle Square (which is one of the most popular attraction in Langkawi). Relaxed guesthouse which is offering basic dorms rooms. We have fan room and also air conditioner room in guesthouse. About the facilities, we have free Wi-Fi, card games, books exchange, plus a shared kitchen, and a cozy living room. Besides, we have shower heater, fridge, instant hot water dispenser, toaster maker and continental breakfast. ***Property Policies & Conditions: 1. Cancellation policy: At least 1 day advance notice for free cancellation. 2. Check in from 14:00pm to 20:00pm. 3. Check out 12:00 noon. 4. Payment upon arrival by only cash. 5. Complimentary Bread and jam. 6. Age restriction: No Kids allow. 14+. 7. Limited reception working hours.  View House Rules  ",unknown,7.3,Hostel,7.3,Clover Guesthouse,US$5.79,7.5,Very Good,6,7.3,"Free Breakfast, Free City Maps, Free Parking, Free WiFi, Air Conditioning, Bicycle Parking, Book Exchange, Common Room, Dishwasher, Fridge/Freezer, Hair Dryers, Hot Showers, Iron / Ironing Board, Parking, Security Lockers, Self-Catering Facilities, Reception (limited hours), Tours/Travel Desk, Board Games",9.3,8.7
10.0,Langkawi,10.0,Malaysia,"Butterfly Guest House is located in heart of Langkawi Island, The Butterfly Place has taken me five years to build. This garden, perched on the hillside of a tropical Rain-Forest, immediately takes one into an unforgettable experience of the lost natural flow. The Butterfly Secret is about the lost Magic of Transformation, a lost art to be regained, when modern life-styles has so bluntly robbed us of this innocence, what is essentially ours. At the Butterfly Place, the lost seed of the Art of Transformation will be sowed. Here, we allow nature to take us back to the place we were before.  As we seek the healing of herbal baths, healing touch massage, chi-kung exercise, we also seek to understand the nature of the dreaming mind in a dreaming universe. And all of this lost Magic of Living is embedded in a fantasy novel –Secrets of a Butterfly—which has taken me sixteen years to write. We have different room types available for you to choose from: Private Butterfly Rooms with Mountain View and Long House Dormitory Rooms. Butterfly Guest House, is perched on the hillside, overlooking the sea, in a natural Tropical Rain-Forest garden environment. The place is teeming with wild birds, butterflies, and herbal fauna, and we need to enjoy them without causing any harm.  View House Rules  ",unknown,8.0,Hostel,10.0,Butterfly Guest House,US$6.95,9.4,Superb,155,10.0,"Free Breakfast, Free City Maps, Free Internet Access, Free Parking, Free WiFi, Adaptors, BBQ, Bicycle Parking, Ceiling Fan, Common Room, Cooker, Hot Showers, Outdoor Terrace, Parking, Reading Light, Security Lockers, Self-Catering Facilities, Airport Transfers, Bicycle Hire, Internet Access, Late check-out, Laundry Facilities, Luggage Storage, Tours/Travel Desk, Towels for hire, Mini-Supermarket, Tea & Coffee Making Facilities, Wi-Fi",10.0,8.0
8.0,Langkawi,7.0,Malaysia,"Rasta Haus is one the latest edition of hostel in Langkawi and is situated in a fishing village known as Kampong Kuala Teriang, about 10 mins drive from the Airport, where the sun sets in, and not far from the Seven Wells Waterfall, Telaga Harbour Park (ferry terminal to Ko Li Pe) and the must see Langkawi Sky Bridge and Cablecar. Our neighbourhood includes the Cenang Beach, Black Sands Beach, Skull Beach and Duty Free shops. We offer 2 dormitory rooms (mix dorms and female dorms with fans.). We are a back to basic's community hostel. No Wifi and hot water available. Come to our place not just as a guest but be part of the community and create a memorable experience on the island. Scooter rental,Car rental, Ferry transfer, Airport transfer and private transportation also available 24/7 upon request and subjected to extra charges. Text us for more details.  View House Rules  ",unknown,7.0,Hostel,7.0,Rasta Haus,US$3.48,8.1,Fabulous,3,9.0,"Free City Maps, Free Parking, BBQ, Bicycle Parking, Breakfast Not Included, Ceiling Fan, Common Room, Cooker, Fridge/Freezer, Outdoor Terrace, Parking, Towels Not Included, 24 Hour Security, Airport Transfers, ATM, Bicycle Hire, Express check-in / out, Laundry Facilities, Luggage Storage, Postal Service, Reception (limited hours), Tours/Travel Desk, Towels for hire, Tea & Coffee Making Facilities",10.0,9.0
3.0,Langkawi,4.0,Malaysia,"Renovated in 2014, the The Village Langkawi guarantees guests a pleasant stay whether in Langkawi for business or pleasure. The hotel is not too far from the city center: just 15.3 km away, and it normally takes about 15 minutes to reach the airport. With its convenient location, the hotel offers easy access to the city's must-see destinations. Offering hotel guests superior services and a broad range of amenities. The Village Langkawi is committed to ensuring that your stay is as comfortable as possible. While lodging at this wonderful. Our villas are flourished with tropical gardens full of traditional leaves. Each room is furnished with resting area right outside the room and amenities such as air-con, water heater, mini bar, kettle, LCD TV and WiFi (cable Optic).Here at The Village Langkawi, we offer 4 types of charming rooms exclusively for all types of travelers such as families.  View House Rules  ",unknown,6.0,Hostel,5.0,The Village Langkawi,US$6.72,5.0,Rating,69,6.0,"Free Breakfast, Free City Maps, Free Parking, Free WiFi, Linen Included, Towels Included, Adaptors, Air Conditioning, BBQ, Bicycle Parking, Book Exchange, Card Phones, Cooker, Dryer, Fridge/Freezer, Hair Dryers, Hot Showers, Microwave, Parking, Washing Machine, 24 Hour Security, ATM, Bicycle Hire, Currency Exchange, Housekeeping, Internet Access, Late check-out, Laundry Facilities, Luggage Storage, Reception (limited hours), Tours/Travel Desk, Tea & Coffee Making Facilities, Board Games, Wi-Fi",6.0,5.0
,Langkawi,,Malaysia,"Located 1.7km from Pantai Tengah, 2Coconuts Hostel and Guesthouse offers mixed dormitory, single and queen rooms for a clean, comfortable and fun stay. A great choice for you to explore the beauty of Langkawi. Start your day in our sunny island with our inclusive self served breakfast of toast, jam, coffee and tea. Ask our friendly staff for great deals on motorbike rentals, tours, recommendation on attractions, fun facts, lame puns (last three are 100% free). Just a hostel run by two coconuts - a lady coconut and a manly coconut.  Go loco with us at 2Coconuts! Important Information： Reception Hours: from 10:00 to 21:00 Checkin: from 14:00 to 21:00 Checkout: from 6:00 to12:00 Payment upon arrival by cash only. Cancellation Policy: 3 days before arrival day. In case of a late cancellation or No Show, you will be charged the first night of your stay. Tax included Breakfast included Age Restriction: Guest must be above 18 years old. No curfew Smoking not allowed in room; but we have certain smoking area.  View House Rules  ",unknown,,Hostel,,2Coconuts Hostel & Guesthouse,US$5.21,,,0,,"Free Breakfast, Linen Included, Air Conditioning, Bicycle Parking, Ceiling Fan, Cooker, Fridge/Freezer, Hot Showers, Self-Catering Facilities, Utensils, Express check-in / out, Luggage Storage, Reception (limited hours), Tea & Coffee Making Facilities, Wi-Fi",,
,Langkawi,,Malaysia,"Triang Guest House offers twin beds and double beds available for each room. Every room has air-conditioner and free wifi available. There is Cafe available at the behind of our Guest House. We are also offering paid breakfast for guests, which is RM 5 per meal. Cenang Beach is about 15 minutes from the Guest House. Beautiful scenery can be seen at the backside of the Guest House. To reach the Cable car, just take about 30 minutes to reach. Route from the airport is about 10 minutes. To go to Kuah will be taking about 30 minutes journey. Terms & Conditions Cancellation policy: 3 days before arrival. In case of a late cancellation or No Show, you will be charged the first night of your stay. Check in from 13:00 to 14:00 . Check out from 12:00 to 13:00 . Reception hours: 12:00 to 14:00. Taxes included. Breakfast included. No curfew. Child friendly only if with the guardian check in to private rooms. Non smoking. Cash only.  View House Rules  ",unknown,,Hostel,,Triang Guest House,US$7.65,,No Rating,0,,"Free Breakfast, Free WiFi, Towels Included, Air Conditioning, Internet Access, Reception (limited hours), Cafe, Wi-Fi",,
,Langkawi,,Malaysia,"S Family Hostel is a very cozy, clean, affordable and convenient hostel located near to Cenang beach in Langkawi Island. It's also in a great location walking distance to nightlife, restaurant, food truck area, mc Donald's, water sport activities and shopping center.our hostel provides air-conditioned with free WiFi, TV lounge, microwave, fridge, kettle, water heater. All units at the hostel are equipped with a seating area and a flat-screen TV. At S Family Hostel, every room is equipped with air conditioning and a shared bathroom. The property is 15km from Langkawi cable car and 7km from mahsuri tomb. When you plan a journey to Malaysia remember that accommodation is very important. Important Information: Cancellation policy: 3 days before arrival day. In case of a late cancellation or No Show, you will be charged the first night of your stay. Check in from 13:00 to 01:00 . Check out from 07:00 to 12:00 . Payment upon arrival by cash. Taxes included. Breakfast not included. No curfew. 24 Hours Reception Smoking Not Allowed in room; but we have certain smoking area.  View House Rules  ",unknown,,Hostel,,S Family Hostel Cenang Beach,US$6.95,,No Rating,0,,"Free WiFi, Air Conditioning, Breakfast Not Included, Cable TV, Common Room, Microwave, 24 Hour Reception, Towels for hire",,
,Langkawi,,Malaysia,"Dorm Master offers accommodation with comfy beds. Free wifi is throughout the property. Located at Jalan Pantai Kok Kuala teriang.5 minute from the Langkawi airport.8km from Langkawi cable car and oriental village. We provide 3 dormitory rooms (mix, male and female dorms). *15 beds,5 bathrooms *8 beds,3 bathrooms *14 beds,4 bathrooms 2 private rooms with 7 single beds 1 queen beds. Personal fan for fan dormitory, privacy curtains, private socket and reading light. Our fan dormitory comes with a shared bathroom. Guests may also rent a car/scooter to explore the area and visit nearby attractions. ***Property Policies & Conditions: 1. Check-in time: from 14:00 2. Check-out time: by 13:00 3. Reception hour: 10:00-22:00 4. Payment: by cash 5. Cancellation Period: 2 days before your arrival. In the event of a late cancellation/no show, you will be charged the first night by accommodation. 6. Age restriction:18+ 7. Nonsmoking 8. Pets are not allowed 9. Breakfast not included 10. Taxes not included 11.No curfew  View House Rules  ",unknown,,Hostel,,Dorm Master,US$4.35,9.1,Superb,2,,"Free City Maps, Free Parking, Free WiFi, Linen Included, Towels Included, Adaptors, Air Conditioning, BBQ, Bicycle Parking, Breakfast Not Included, Ceiling Fan, Hair Dryers, Iron / Ironing Board, 24 Hour Reception, Bicycle Hire, Housekeeping, Late check-out, Luggage Storage, Tea & Coffee Making Facilities, Wi-Fi",,
4.0,Langkawi,6.0,Malaysia,"Bed Attitude Hostel Kuah features air-conditioned rooms with free WiFi. We provide bunk bed dormitory for travellers who seek relaxation and comfortable sleep. Each bed are equipped with reading light, locker, power supply. Shared bathrooms are fitted with hot shower facility mirrors and hair dryers. And if you like, laundry services are also available at a reasonable price. You also can rent scooter from the hostel. We have a big common area for all the traveller to hang out, socialize and meet other people from around the world. Located nearby the city centre,  we are offering you easy access to tourist spots. Important Information: Reception Hours: from 7:00 to 22:00 Check in from 14:00 to 22:00 . Check out before 11:00 . Cancellation policy: 3 days before arrival day. In case of a late cancellation or No Show, you will be charged the first night of your stay. Payment upon arrival by cash. Taxes not included: Government tax 6% on the total bill Breakfast included. No curfew. We do not accept customers younger than 18 years of age. Non smoking in room; but we have certain smoking area.  View House Rules  ",unknown,8.0,Hostel,4.0,Bed Attitude Hostel Kuah,US$0.70,5.4,Rating,1,8.0,"Free City Maps, Free WiFi, Air Conditioning, Breakfast Not Included, Cable TV, Ceiling Fan, Elevator, Fridge/Freezer, Hair Dryers, Hot Showers, Iron / Ironing Board, Microwave, Reading Light, Safe Deposit Box, Security Lockers, Towels Not Included, Housekeeping, Internet Access, Reception (limited hours), Tours/Travel Desk, Wi-Fi",6.0,2.0
,Langkawi,,Malaysia,"Welcome to Indiana Cafe and Dorm, your second home while traveling. We love to meet people from everywhere in the world. Our hostel is in the area of Cenang's main road. Our dorm offers good space and a relaxing vibe while our private rooms are situated across the road where we provide privacy for our guests. We provide you spaces to chill, talk, laugh, eat and drink at our special outside area - a wooden cafe with a relaxing terrace. Our Cafe serves vegan and vegetarian food. You can rent scooters, get your laundry done and book tours and tickets with us. We will give you all the information you like to know. Important Information: Cancellation policy: 2 days before arrival day. In case of a late cancellation or No Show, you will be charged the first night of your stay. Check in from 14:00 to 18:00 . Check out from 08:00 to 12:00 . Reception hours: 09:00 to 18:00. Taxes included. Breakfast included. No curfew. Respect other people. Child friendly only if with guardian checking in to private rooms. Non smoking except for specific areas. Cash only.  View House Rules  ",unknown,,Hostel,,Indiana Cafe and Dorm,US$5.79,10.0,Superb,1,,"Free Breakfast, Free City Maps, Free Parking, Free WiFi, Linen Included, Towels Included, Adaptors, Air Conditioning, BBQ, Bicycle Parking, Book Exchange, Ceiling Fan, Common Room, Fridge/Freezer, Outdoor Terrace, Parking, Bicycle Hire, Express check-in / out, Laundry Facilities, Reception (limited hours), Cafe, Tea & Coffee Making Facilities, Board Games, Wi-Fi",,
9.2,Langkawi,9.2,Malaysia,"J Dorm Hostel is a very cozy, clean, affordable and convenient hostel located near to Tengah beach and Cenang beach in Langkawi Island. At the hostel, The rooms come with air conditioning and free WIFI. J Dorm Hostel offers travelers who seek relaxation and comfortable sleep. Each room equipped with personal lockers and power supply. Shared bathrooms are fitted with hot shower facility mirrors and hair dryers. We provide free simple Breakfast and coffee and tea in the morning. We have a common area for all the travelers to hang out, socialize and meet other people from around the world. 1. Check-in time: from 14:00-22:00 2. Check-out time: by 12:30 3. Reception hour: 10:00-22:00 4. Payment: cash only 5. Cancellation Period: 3 days before your arrival. In the event of a late cancellation/no show, you will be charged the total amount by accommodation. 6. Children are welcome 7. No smoking in the room, but have a smoking area 8. Pets are not allowed 9. Breakfast included 10. Taxes included 11.No curfew  View House Rules  ",unknown,9.2,Hostel,8.2,J Dorm,US$6.95,9.1,Superb,10,9.2,"Free Breakfast, Free City Maps, Free Internet Access, Free Parking, Free WiFi, Air Conditioning, Bicycle Parking, Book Exchange, Ceiling Fan, Common Room, Fridge/Freezer, Hair Dryers, Hot Showers, Outdoor Terrace, Parking, Security Lockers, Towels Not Included, Housekeeping, Internet Access, Luggage Storage, Reception (limited hours), Tours/Travel Desk, Towels for hire, Tea & Coffee Making Facilities, Board Games",9.8,8.8
7.3,Langkawi,8.7,Malaysia,"Located along Jalan Bohor Tempoyak, Vila Thai is conveniently within a 10-minute walk to the famous Pantai Cenang. Common area where you can enjoy and meet people is provided. Our fan dormitory come with shared bathroom offering shower facility. Vila Thai features a spa and wellness centre, where guests can indulge in a pampering massage. Guests may also rent a car to explore the area and visit nearby attractions. For food, a tasty selection of Thai and local Halal food is served at the restaurant within a few minutes’ walk away. Vila Thai is opposite Thursday night market. There will be a lot of food stalls on that day. We are also opposite Cenang Muay Thai Gym. There is also a small road opposite our place that will easily get you to the beach within few minutes walk.  Types on dormitory; 16 beds fan dorm (downstairs) & 10 beds rooftop fan dorm which our guests will be able to enjoy the view from here. Vila Thai Policies & Conditions: Cancellation policy: 72 hours before arrival. Check in from 2:00. Check out before 12:00. Payment upon arrival by cash only. Taxes included. Breakfast not included. General: Reception opening times; 09:00- 23:00.  View House Rules  ",unknown,8.0,Hostel,9.3,Vila Thai,US$3.71,8.5,Fabulous,90,9.3,"Free Parking, Free WiFi, Breakfast Not Included",7.3,9.3
3.3,Langkawi,5.3,Malaysia,"D'lima Beach Inn located near to Pantai Cenang Beach. D'lima has the best swimming pool for adults and children, garden and every type of room with the best environment; quiet place and very beautiful view. Every room has mini bar , kettle, towel, soap, water heater, toilet paper, tea maker facilities and best air condition room. D'lima also offers Island Hopping, Mangrove, Helicopter tour, Snorkeling Langkawi, Rent a car and Moto packages. Pick and drop facilities on demand but will be an extra charge, Front Desk 24/7 Service. Mini Canteen, Breakfast also provided. Policies: - Cancellation policy: 2 days before arrival day. In case of a late cancellation or No Show, you will be charged the first night of your stay. - Check in from 14:00 to 23: 00. - Check out from 07:00 to 12: 00. - Reception: 8:00 to 11:00 - Taxes not included - A tourist tax of RM 10 per room (ONLY FOR PRIVATE ROOMS) per night is applied to all foreign guests. This tax is not included in the room rate and must be paid upon check-in. Guests with a valid Malaysian Identity Card or valid permanent residents MY PR Card are exempted. - Breakfast not included. - No curfew. - Child-friendly. - Smoking not allowed in room; but we have certain smoking area.  View House Rules  ",unknown,6.0,Hotel,6.7,Dlima Beach Inn Langkawi,US$6.08,5.9,Rating,9,8.0,"Free Internet Access, Free Parking, Free WiFi, Towels Included, Air Conditioning, BBQ, Cable TV, Fridge/Freezer, Hair Dryers, Hot Showers, Indoor Swimming Pool, Iron / Ironing Board, Key Card Access, Parking, Reading Light, Safe Deposit Box, Security Lockers, Swimming Pool, Airport Transfers, Currency Exchange, Fax Service, Housekeeping, Internet Access, Laundry Facilities, Reception (limited hours), Room service (limited hours), Tours/Travel Desk, Minibar, Tea & Coffee Making Facilities, Pool Table, Wi-Fi",5.3,6.7
,Langkawi,,Malaysia,"Located in Pantai Cenang which just 3 minute walk to Cenang Beach, Studio 2 Guesthouse features garden, spacious rooms, and free high-speed WiFi. An unorthodox things about this place; it's surrounded by art from various artist and you can even bring one home! Featuring chilling foyer space, Breakfast Bar the restaurant ready to greet you with western breakfast in the morning. All rooms feature air conditioning, couch and free toiletries. The area is popular for cycling and pedestrian-friendly, car and scooter rental is available at the accommodation. This studio is next to Laman Padi Langkawi (Paddy Museum of Langkawi), while Night Market is just 10 mins walk from the property. The Langkawi Airport is around 10mins car ride. Terms & Conditions Cancellation policy: 2 days before arrival. In case of a late cancellation or No Show, you will be charged the first night of your stay. Check in from 14:00 to 23:00 . Check out from 12:00 to 16:00 . Reception hours: 08:00 to 18:00 . Taxes included. Breakfast not included. No curfew. Pet friendly. Child friendly. Non smoking except specific areas. Cash only.  View House Rules  ",unknown,,Bed and Breakfast,,Studio 2 Guesthouse,US$6.95,,No Rating,0,,"Free Internet Access, Free Parking, Free WiFi, Linen Included, Towels Included, Air Conditioning, Breakfast Not Included, Ceiling Fan, Hair Dryers, Hot Showers, Iron / Ironing Board, Parking, Washing Machine, Express check-in / out, Internet Access, Late check-out, Restaurant, Tea & Coffee Making Facilities, Board Games, Wi-Fi",,
8.9,Langkawi,7.3,Malaysia,"Bunk Inn @ SHAKA Langkawi offers cozy and comfortable beds for backpackers and travelers to unwind after a long journey to Langkawi or through South East Asia. Bunk Inn @ SHAKA Langkawi consists of two unit of 4 bedded dorm room, indoor hall common area, outdoor common area, garden seating, Kawi fornia surf shop concept store and Barrel Backyard BBQ. The hostel is less than 5 minutes walk to nearest beach Pantai Tengah footpath access, 10 minutes walk to Pantai Tengah main entrance and 5 minutes drive to Pantai Cenang main beach. **Things to note & policies** Free cancellation: 1 day before the arrival Check in from: 2pm Check out before: 12pm Reception time: 24 hours Payment on arrival: cash only Tax not included Free breakfast included No curfew No smoking in room but have smoking area Pets are not allowed  View House Rules  ",unknown,7.6,Hostel,8.9,Bunk Inn @ SHAKA Langkawi,US$8.11,8.4,Fabulous,10,8.0,"Free Breakfast, Free City Maps, Free Internet Access, Free Parking, Free WiFi, Linen Included, Towels Included, Air Conditioning, BBQ, Bicycle Parking, Common Room, Cooker, Fridge/Freezer, Hair Dryers, Hot Showers, Outdoor Terrace, Parking, Security Lockers, 24 Hour Reception, Internet Access, Luggage Storage, Tours/Travel Desk, Tea & Coffee Making Facilities, Board Games, Nightclub, Wi-Fi",9.6,8.9
9.6,Langkawi,8.8,Malaysia,"Purple Haze is a hidden oasis on the west side of Langkawi where the sun sets in. A community based chill out spot and dormitory by the mangroves for those free spirits.. We offer one fan dormitory with 8 bunk beds and 1 lil´ private room with a queen bed, fan and sea view. Apart from just a Hostel Purple Haze is also a place to hang out, meet travelers and locals. You can have cold beverages, play games or just relax and soak in the sun while watching the flora and fauna Langkawi has to offer. We are 'back to basics' community hostel and not a day care center for flashpackers.. suitable for those old school backpackers. We do not have WIFI or AC but good vibes and awesome people. Come to our place not just as a guest but be part of the community and create a memorable experience on the island. **Property Policies & Conditions: 1. Cancellation policy: At least 2 days advance notice for free cancellation. 2. Check in from 14:00 to 22:00. 3. Check out before 12:00 noon. 4. Payment upon arrival by cash. 5. Smoking outside. 6. Age restriction: 18 - open end. 7. Reception working hours: 10:00-22:00.  View House Rules  ",unknown,9.2,Hostel,9.6,Purple Haze Tavern,US$5.21,9.4,Superb,36,9.4,"Free Parking, Linen Included, Towels Included, BBQ, Bicycle Parking, Book Exchange, Breakfast Not Included, Common Room, Cooker, Fridge/Freezer, Outdoor Terrace, Parking, Security Lockers, Self-Catering Facilities, Utensils, Reception (limited hours), Bar, Tea & Coffee Making Facilities, DVD's",10.0,9.4
