atmosphere,city,cleanliness,country,description,distance,facilities,kind,location,name,price,rating,rating_cat,reviews,security,services,staff,value_for_money
,Siem Reap,,Cambodia,"* BEST RATE & SMART LOCATION CLOSE TO ANGKOR WAT COMPLEX Experience all that Siem Reap has to offer in our stylish 4 star International hotel. The Tara Angkor Hotel is an ideal base to explore Siem Reap and the magnificent temples steeped in legend and history. Tara Angkor is conveniently located on the road to Angkor only 5km from the entrance, 15 minutes from the airport and a short ride to the centre of town. The Tara Angkor with 206 rooms is also equipped with modern amenities and is elegantly furnished to make your stay luxurious and enjoyable. With exceptionally warm hospitality and traditional Cambodian sincerity and kindness your stay will be something not to be forgotten. Hotel Facilities: Our stylish 4 star property has cemented its status as one of the jewels in Siem Reaps accommodation sector. Our facilities include 206 magnificent rooms and suites, Two Restaurants, a Lobby Bar, and a Swimming Pool with Jacuzzi, Fitness and a Sauna.  Further to this, we provide additional services and facilities designed to ensure your stay is both pleasurable and memorable. * Conference room, restaurant and lobby bar * Outdoor Swimming pool 115sqm with Jacuzzi * Fitness center * Room Service * Babysitting * Valet Parking * Free bicycle usage * Evening turn down service * Guest Relations with Japanese and French speaking staff * Tour desk * Business centre * Free internet (WiFi) in Lobby area, restaurants and all guests room. * Concierge and airport service * Foreign currency exchange * Gift shop * Laundry and dry cleaning service * Fax, photocopy and internet access * SPA  View House Rules  ",unknown,,Hotel,,Tara Angkor Hotel,US$26.60,,No Rating,1,,"Free Airport Transfer, Free Breakfast, Free Internet Access, Free Parking, Free WiFi, Air Conditioning, Elevator, Fitness Centre, Hair Dryers, Hot Showers, Outdoor Swimming Pool, Parking, Safe Deposit Box, Security Lockers, Swimming Pool, Wheelchair Friendly, 24 Hour Reception, Airport Transfers, Bicycle Hire, Business Centre, Concierge, Currency Exchange, Fax Service, Housekeeping, Internet Access, Laundry Facilities, Luggage Storage, Room service (limited hours), Tours/Travel Desk, Bar, Minibar, Restaurant, Tea & Coffee Making Facilities, Wi-Fi",,
,Siem Reap,,Cambodia,"Adventure Hostel Siem Reap, an amazing place to stay for the spirit of your adventure, with cleaned and secured environment living concept. What we have? - 24 hours reception - 2 minutes walk to the old market, night market, pub street,...and many more.. - Most of the bus stations and airport are about 5 to 10 min by tuk-tuk or motorbike - Deluxe hostel bed and privacy sleeping even it is hostel - 24 hour generator back up since the city is brown-out so often - All rooms equipped with air-con - Towel is free - Hot-shower is ready in every bathroom - Our tour desk will help you to explore the city and the temples with the very reasonable price - Wifi is free - The most safe-area in the city 24/7 The hostel location is one thing for you to consider, we don't cheat guest on our location. Check-in at Adventure Hostel Siem Reap, you save the time and the money.  View House Rules  ",unknown,,Hostel,,Adventure Hostel Siem Reap,US$8.00,,No Rating,6,,"Free Internet Access, Free Parking, Free WiFi, Linen Included, Towels Included, Air Conditioning, Bicycle Parking, Breakfast Not Included, Cable TV, Cooker, Dryer, Hair Dryers, Hot Showers, Iron / Ironing Board, Key Card Access, Outdoor Terrace, Parking, Reading Light, Safe Deposit Box, Security Lockers, Washing Machine, 24 Hour Reception, 24 Hour Security, Airport Transfers, ATM, Bicycle Hire, Currency Exchange, Express check-in / out, Internet Access, Laundry Facilities, Tours/Travel Desk, Cafe, Meals Available",,
10.0,Siem Reap,10.0,Cambodia,"Welcome to Prasats' Siem Reap. It is 10 minutes away from the busy city center, 12 minutes away from the historic Angkor Wat! The staff at Prasats' Siem Reap are available 24/7 to assist you with information, requests, security & more. We have shared, twin & private rooms available. Our guests are usually solo travelers, couples, business travelers, groups and families with children. Prasats' Siem Reap provides access to bicycle & motorbike rentals and can request independent tuk tuks free pick up that will get you to where you need to be! There are also convenient transportation apps. **Things to note & policies** Cancellation notice: 2days before the arrival Check in from: 14:00~0:00 Check out before: 12:00 Reception time: 24h Payment on arrival: cash only Tax included in room rate Breakfast not included No smoking in room but have smoking area Child friendly Pets are not allowed  View House Rules  ",unknown,8.0,Hostel,8.0,Prasats Siem Reap,US$10.50,9.1,Superb,1,10.0,"Free Internet Access, Free Parking, Free WiFi, Linen Included, Towels Included, Air Conditioning, Breakfast Not Included, Ceiling Fan, Common Room, Fridge/Freezer, Hair Dryers, Outdoor Terrace, Security Lockers, 24 Hour Reception, Housekeeping, Internet Access, Luggage Storage, Tea & Coffee Making Facilities, Wi-Fi",10.0,8.0
6.5,Siem Reap,7.0,Cambodia,"UNCLE’S HOUSE -SIEM REAP is a simple but comfortable cheapest budget accommodation for all types of travelers. Volunteers, foreign teachers, and backpackers whether you are looking for a long stay or just an overnight stop, you are all welcome to stay with our family!  View House Rules  ",unknown,7.0,Hostel,6.0,Uncle`s House - Siem Reap,US$2.23,7.2,Very Good,74,7.5,"Free City Maps, Free Internet Access, Free WiFi, Adaptors, Bicycle Parking, Book Exchange, Breakfast Not Included, Ceiling Fan, Common Room, Fridge/Freezer, Linen Not Included, Outdoor Terrace, Reading Light, 24 Hour Reception, Bicycle Hire, Currency Exchange, Express check-in / out, Internet Access, Late check-out, Luggage Storage, Postal Service, Reception (limited hours), Shuttle Bus, Tours/Travel Desk, Towels for hire, Meals Available, Restaurant, Wi-Fi, Wii",8.0,8.5
,Siem Reap,,Cambodia,"World Walker HOSTAL is the cheaper than all budget place in Siem Reap.  World Walker Hostal is not only the best place for a stop of travelers for next Distination relax and either is the comfortable accommodation for all cool world travellers and world walker meet and sharing world traveling experience. World Walker HOSTAL is just a couple minutes walking to local market for local food, fruits, and other. The staff here are happy to assist you with tour information, tour arrangement, bicycle/car rentals, luggage storage, and laundry services, bus ticket, air ticket, massage, food , drinks, cooking class, show, airport shuttle service and other related on your holiday in Siem Reap.  View House Rules  ",unknown,,Hostel,,World Walker HOSTAL,US$2.25,,No Rating,0,,"Free Internet Access, Free Parking, Free WiFi, Bicycle Parking, Breakfast Not Included, Hair Dryers For Hire, Linen Not Included, Outdoor Terrace, Towels Not Included, Bicycle Hire, Express check-in / out, Late check-out, Luggage Storage, Reception (limited hours), Tours/Travel Desk, Towels for hire, Meals Available, Restaurant, PlayStation, Wi-Fi",,
8.4,Siem Reap,8.4,Cambodia,"Welcome to Happy Guest House Happy Guest House is a popular accommodation owned by a Cambodian family whom provide all guests with excellent hospitality, honesty, and sincere friendliness.  The owner of Happy Guest House speaks excellent English, French and Vietnamese.  Happy Guest House is designed for the traveler who wants the comfort of a nice and clean guest house at a reasonable price. Happy Guest House has the atmosphere of homely stay while you are away from home. Our guest house is centrally located just off the main road on a quiet and safe street. (15min walk to the old market/Pub Street) The surrounding area has many guest houses, ATMs, Marts, Restaurants, BBQ areas, Gym, massages, and salons. If you are hot from a long day of exploring Siem Reap, relax and enjoy a swimming pool that is less than 1 min walk from our guest house for only $3 for the entire day! * Free Wi-Fi * Free computers in lobby * Free City and temples map * Free Water on arrival and check out day Services offered by Happy Guest House 1. Restaurant start from 6:00am-10:00pm 2. Bicycle/ Electric bike/ Motorbike Rental 3. Transportation arrangement 4. Taxi arrangement 5. Bus/Boat/Air ticket information and reservation 6. Laundry Service 1kg= $ 1.00 7. Oversea Call 1mn = $ 0.25 8.   Massage 10. Tour Reservation (including unique Happy Guest House discounts) 11. Temples Tour information and Transportation Rate (Share Tour or Private tour) 12. Experiences Guide reservation : English, French 13. Visa arrangement 14. Money Exchange 15. Printing 1 paper = $ 0.15 Please Note: ***Pick up service information*** •       Airport: transportation is free but need to pay $1.5 for the airport entrance fee •Bus station: bus company’s name, departure time, departure place •Boat station ( 15km away from town)   Fees : $4/ tuk tuk For guests who kindly give the job to our drivers who pick you up from any stations, our driver will free of charge for the all pick up service from any place. Please do let us know your arrival time information if you may need pick up service from our property!! BEWARE TUK SCAM! Other guest houses pay Tuk Tuk drivers a commission to take you to their hotel, usually because they are far away out of town. Tuk Tuk  drivers often give out false information to try and convince travellers to stay somewhere else, for example they may say that this hostel is full. They may also try and claim that there is a second happy guesthouse - there is only ONE happy guesthouse. We offer a Free pick up service, please contact us with your arrival details by bus, boat or airplane and we will have free transport ready and waiting for you at any time of the day or night. Once you have booked just look out for the sign with your name on it! Please feel free to contact us for any inquiries CHHORPOAN family and staff  View House Rules  ",unknown,7.6,Hostel,8.4,Happy Guest House,US$5.00,8.3,Fabulous,869,8.4,"Free City Maps, Free Internet Access, Free Parking, Free WiFi, Linen Included, Towels Included, Air Conditioning, BBQ, Bicycle Parking, Book Exchange, Breakfast Not Included, Cable TV, Ceiling Fan, Common Room, Hair Dryers, Hair Dryers For Hire, Hot Showers, Outdoor Terrace, Parking, Safe Deposit Box, Security Lockers, 24 Hour Reception, 24 Hour Security, Airport Transfers, Bicycle Hire, Currency Exchange, Housekeeping, Internet Access, Laundry Facilities, Luggage Storage, Postal Service, Tours/Travel Desk, Bar, Meals Available, Restaurant, Wi-Fi",8.4,8.8
7.0,Siem Reap,6.0,Cambodia,"Garden Village is the BEST place to stay in Siem Reap. A picturesque hostel set in lush tropical gardens & near major attractions, Pub Street, Night Market & the awe-inspiring Angkor Wat temples which can be easily visited with the help of our friendly staff & tour desk. Garden Village is affordable with a great selection of rooms to cater for any budget starting from $3.50 deluxe dorms with A/C & en-suite to our luxurious Khmer style bungalow suites at $27 with free WIFI throughout the hostel. Our restaurant & pool bar are open 24/7 & serve a variety of delicious Khmer & Western favorites at amazing prices. We have a large pool, swim up bar with Jacuzzi and basketball hoop. Our hostel is large enough for you to feel free to party or relax with activities such as volleyball court, sand football pitch, slack-lines, pool table, beer pong, movie room & much more. There's always something to keep you entertained! Garden Village is a great place to meet friends from all over the world!  View House Rules  ",unknown,6.0,Bed and Breakfast,9.0,Garden Village Guest House,US$4.00,7.3,Very Good,707,8.0,"Free City Maps, Free Internet Access, Free Parking, Free WiFi, Linen Included, Towels Included, Air Conditioning, BBQ, Bicycle Parking, Book Exchange, Breakfast Not Included, Card Phones, Ceiling Fan, Hot Showers, Outdoor Swimming Pool, Outdoor Terrace, Parking, Reading Light, Safe Deposit Box, Security Lockers, Swimming Pool, Washing Machine, Wheelchair Friendly, 24 Hour Reception, 24 Hour Security, Currency Exchange, Express check-in / out, Housekeeping, Internet Access, Internet café, Late check-out, Laundry Facilities, Luggage Storage, Postal Service, Tours/Travel Desk, Wake-up calls, Bar, Café, Meals Available, Restaurant, Board Games, Wi-Fi",7.0,8.0
,Siem Reap,,Cambodia,"Bunwin Boutique Hotel overlooks the heart of Siem Reap and it is only a short drive to the International Airport alluring Temple of Angkor, Heritage Park. This exclusive retreat has only 2 suites and 8 deluxe and 1 family room, ultra-modern poolside rooms, ensuring quality personal service and traditional Khmer hospitality. The rooms have been designed for stylish simplicity with all the latest technologies to offer a relaxing and rejuvenating stay. All rooms have been paved with polished concrete flooring in black and white on the interior with a delicate touch of Cambodian artwork. All dedicated team provides with a full range of concierge services such as: complimentary airport pickup and transfer, downtown shuttle, private tour arrangement in Siem Reap, and free use of laptop with WIFI connection and local mobile phone. **Things to note & policies** Free cancellation: 1 day before the arrival. Check in from 2:00 pm Check out before 12:00 pm Payment on arrival: cash and credit card Tax included Breakfast included No curfew Pet are not allowed No smoking in room, but have smoking area Age restriction: under 11 years old can be join bed Reception working period/time: 24h  View House Rules  ",unknown,,Hotel,,Bunwin Boutique Hotel,US$21.33,,No Rating,0,,"Free Airport Transfer, Free Breakfast, Free City Maps, Free Internet Access, Free WiFi, Towels Included, Adaptors, Air Conditioning, Bicycle Parking, Cable TV, Dryer, Fridge/Freezer, Hair Dryers, Hot Showers, Hot Tub, Iron / Ironing Board, Outdoor Swimming Pool, Outdoor Terrace, Parking, Safe Deposit Box, Swimming Pool, 24 Hour Reception, 24 Hour Security, Airport Transfers, Bicycle Hire, Business Centre, Currency Exchange, Housekeeping, Internet Access, Late check-out, Postal Service, Room service (limited hours), Shuttle Bus, Tours/Travel Desk, Wake-up calls, Bar, Café, Minibar, Restaurant, Tea & Coffee Making Facilities, Wi-Fi",,
10.0,Siem Reap,10.0,Cambodia,"Welcome to Neth Socheata Hotel Siem Reap!  Offering exquisite style, spacious guestrooms, and most importantly, seamlessly intuitive service and personalized comfort, Neth Socheata Hotel is an ideal getaway for leisure and business travelers alike. We are centrally located with Siem Reap's finest shops, bars and restaurants on our doorstep. We hope that your stay with us will spark your appetite for fun and adventure.  At Neth Socheata Hotel, we consider every day and every moment an opportunity to surprise, delight and celebrate you. Our flagship restaurant, Socheata Restaurant, offers a refreshing and sophisticated range of Khmer cuisine, delicious culinary creations conjured up by our very own experienced kitchen staff. ***Property Policies & Conditions: 1. Cancellation policy: 3 days before arrival. 2. Check in from 14:00 to 22:00. 3. Check out before 12 noon 4. Payment upon arrival by cash. Credit card is accepted. 5. Reception working hours: 24 hours. 6. No age restriction. 7. Taxes included. 8. Breakfast not included. 9. No pets.  View House Rules  ",unknown,8.0,Hotel,10.0,Neth Socheata Hotel,US$40.00,9.7,Superb,2,10.0,"Free Airport Transfer, Free City Maps, Free City Tour, Free Internet Access, Free WiFi, Towels Included, Adaptors, Air Conditioning, Bicycle Parking, Book Exchange, Cable TV, Dryer, Fridge/Freezer, Hair Dryers, Hair Dryers For Hire, Hot Showers, Key Card Access, Safe Deposit Box, 24 Hour Reception, 24 Hour Security, Airport Transfers, ATM, Bicycle Hire, Business Centre, Concierge, Currency Exchange, Express check-in / out, Fax Service, Housekeeping, Internet Access, Internet café, Late check-out, Laundry Facilities, Luggage Storage, Postal Service, Room service (limited hours), Tours/Travel Desk, Wake-up calls, Café, Minibar, Restaurant, Tea & Coffee Making Facilities, Wi-Fi",10.0,10.0
,Siem Reap,,Cambodia,"A high star Hotel offered a free pick service from the airport/bus station. Angkor Year Theme Hotel has a great location in the heart of the town, walking distance to the shopping center. High star hotel with a budget price is offered. We are providing the first best deals in Siem Reap. With the star services are provided here. Full furniture lobby and living room. Rooms equipped with air-conditioning and wifi available throughout the property. Situated in Siem Reap, 700 meters from Pub Street, Angkor Year Theme Hotel features accommodation with a restaurant, free private parking, an outdoor swimming pool, and a bar. Boasting a garden, the hotel is close to several noted attractions, around 1.4 km from King's Road Angkor, 500 meters from Angkor Night Market and 700 meters from Lucky Mall Siem Reap. The accommodation offers a 24-hour front desk, room service and currency exchange for guests. Terms & Conditions Cancellation policy: 1 day before arrival. In case of a late cancellation or No Show, you will be charged the first night of your stay. Check in from 14:00 to 23:00 . Check out from 07:00 to 12:00 . 24 hours reception. Taxes included. Breakfast included. No curfew. Child friendly. Non smoking. 1  View House Rules  ",unknown,,Hotel,,Angkor Year Theme Hotel,US$11.67,,No Rating,0,,"Free Airport Transfer, Free Breakfast, Free City Maps, Free Internet Access, Free Parking, Free WiFi, Linen Included, Towels Included, Adaptors, Air Conditioning, Bicycle Parking, Book Exchange, Cable TV, Elevator, Fridge/Freezer, Outdoor Swimming Pool, Safe Deposit Box, Swimming Pool, 24 Hour Reception, 24 Hour Security, Airport Transfers, Bicycle Hire, Concierge, Currency Exchange, Express check-in / out, Housekeeping, Late check-out, Laundry Facilities, Postal Service, Room service (limited hours), Tours/Travel Desk, Wake-up calls, Bar, Café, Meals Available, Mini-Supermarket, Minibar, Restaurant, Wi-Fi",,
6.0,Siem Reap,7.0,Cambodia,"Nuon Oudom Angkor Boutique is standing on the attraction walking area and located in the pop of centre in Siem Reap, an 8-minute walk from Pub Street. Nuon Oudom Angkor Boutique has a number of amenities including a restaurant, a bar, a garden and free WiFi. 0.6 miles from King's Road Angkor, the property is also 4.1 miles away from Angkor Wat. Angkor Night Market is a 4-minute walk from the hotel and Artisans D'Angkor is 500 yards away. At the hotel, the rooms have a desk. Each room is equipped with a private bathroom and a shower, while certain rooms include a terrace. The 24-hour front desk can offer helpful tips for getting around the area. Popular points of interest near Nuon Oudom Angkor Boutique include Platinum Cineplex Siem Reap, Old Market and Angkor Trade Centre. The nearest airport is Angkor International Airport, 4.3 miles from the accommodation. Terms & Conditions Cancellation policy: 3 days before arrival. In case of a late cancellation or No Show, you will be charged the first night of your stay. Check in from 14:00 to 23:00 . Check out from 06:00 to 12:00 . 24 hours reception. Taxes included. Breakfast not included. No curfew. Child friendly. Non smoking except specific areas. Cash only.  View House Rules  ",unknown,8.0,Hotel,9.0,Nuon Oudom Angkor Boutique,US$10.00,8.0,Fabulous,2,9.0,"Free City Maps, Free Internet Access, Free Parking, Free WiFi, Linen Included, Towels Included, Air Conditioning, Bicycle Parking, Breakfast Not Included, Cable TV, Ceiling Fan, Fridge/Freezer, Hot Showers, Outdoor Swimming Pool, Outdoor Terrace, Parking, Reading Light, Swimming Pool, 24 Hour Reception, Airport Transfers, Bicycle Hire, Concierge, Express check-in / out, Housekeeping, Internet Access, Internet café, Late check-out, Laundry Facilities, Shuttle Bus, Tours/Travel Desk, Café, Pool Table, Wi-Fi",9.0,8.0
,Siem Reap,,Cambodia,"Our Downtown Siem Reap Villa is a 5-minute walk to the vibrant nightlife of the famous Pub Street, Old market, Night Market and the city center. Both Sitha and I are are from Minnesota, USA and we run our business in a friendly, western style. Our air conditioning equipped rooms are very comfortable with hot shower, our pool is super clean, our famous Star Bar restaurant and pub serves delicious Khmer and Western comfort food, wicked great drinks, ice cold beer and there is high speed WiFi throughout. Our guests enjoy hanging out just across the pool at the Star Bar. We have a very fun mix of customers each day that include local Khmers, local expats, school teachers, hospitality workers, medical workers, and tourists.We are amazed at how fun and diverse our guests are. Most of them are very educated, smart, funny, mature, reasonable people. You can be sure you'll meet people who are doing super interesting and great things in their lives! We passionately believe in having a great time with positive vibes and a lot of laughter and because of this, Tim quickly convinces those individuals who are ruining the positive energy to leave. Our friendly staff can help you book tours, activities or buses. We look forward getting to know you during your stay in the Kingdom of Wonder! Terms & Conditions Cancellation policy: 3 days before arrival. In case of a late cancellation or No Show, you will be charged the first night of your stay. Check in from 15:00 to 19:00 . Check out from 07:00 to 12:00 . 24 hours reception. Taxes included. Breakfast not included. No curfew. Child friendly only if with the guardian check in to private rooms. Non smoking except for specific areas. Credit card or Cash payment  View House Rules  ",unknown,,Hotel,,Downtown Siem Reap Villa,US$13.40,,No Rating,0,,"Free City Maps, Free Internet Access, Free Parking, Free WiFi, Linen Included, Towels Included, Adaptors, Air Conditioning, BBQ, Bicycle Parking, Book Exchange, Breakfast Not Included, Ceiling Fan, Hot Showers, Outdoor Swimming Pool, Parking, Safe Deposit Box, Swimming Pool, 24 Hour Reception, 24 Hour Security, Airport Transfers, ATM, Bicycle Hire, Business Centre, Concierge, Express check-in / out, Fax Service, Housekeeping, Internet Access, Late check-out, Luggage Storage, Room Service  (24 hours), Tours/Travel Desk, Wake-up calls, Bar, Café, Meals Available, Mini-Supermarket, Restaurant, Tea & Coffee Making Facilities, Nightclub, Wi-Fi",,
4.0,Siem Reap,6.0,Cambodia,"There is an active bar scene in our restaurant bar and delicious Khmer and international menu available for our guests. We are particularly suited to group stays and are able to arrange transportation, tours and accommodation packages for tour groups. Our reception operates a full tour desk with multiple tour options for the famous Angkor Wat tours for our guests , onward travel, bus booking and visa services are also available. All of our rooms are provided with A/C, snuggly duvets and comfortable pillows. There is a full shop and café available on the ground floor level. Things to note: 1. Check in Time: 12:00-18:00 2. Check out Time: before 12:00 3. Cash payment only upon check in at the property. 4. At least 48 hours in advance notice for free cancellation. The deposit is non-refundable.  View House Rules  ",unknown,6.0,Hostel,8.0,Naga Angkor Hotel,US$5.50,6.6,Good,360,6.0,"Free Airport Transfer, Free City Maps, Free Parking, Free WiFi, Linen Included, Towels Included, Air Conditioning, Cable TV, Ceiling Fan, Common Room, Hot Showers, Security Lockers, 24 Hour Reception, 24 Hour Security, Airport Transfers, ATM, Bicycle Hire, Currency Exchange, Express check-in / out, Housekeeping, Internet Access, Internet café, Late check-out, Luggage Storage, Postal Service, Shuttle Bus, Tours/Travel Desk, Wake-up calls, Bar, Cafe, Meals Available, Restaurant, Tea & Coffee Making Facilities, Wi-Fi",8.0,8.0
9.0,Siem Reap,10.0,Cambodia,"This is NON- SMOKING hotel. We are privately owned and run and aim to provide our guests with a home away from home. Enjoy a friendly, relaxing and intimate stay with us in our 13 exclusive private Deluxe rooms (A/C room), each room comes equipped with 80-channel satellite TV, hot shower, closet, make up desk, full length mirror and and fresh sheets and towels. Each 2 rooms we have 1 kitchenette, 1 living room, 1 or 2 balconies. Oriental Siem Reap offers you the following services: * REE Pick up Service * FREE Tea & Coffee all day * FREE 24-hr High-Speed Internet Access * FREE Wi-Fi all rooms * FREE Daily Bottled Water in Rooms * FREE Mini-bar all rooms * FREE Welcome drink (On Arrival) * FREE Map of Temple & Town * FREE Hot Shower all rooms * 80 International Satellite TV Channels * Travel and Tour Information Enjoy your stay with us :)  View House Rules  ",unknown,6.0,Hotel,10.0,Oriental Siem Reap,US$7.50,9.1,Superb,54,10.0,"Free City Maps, Free Parking, Free WiFi, Towels Included, Air Conditioning, Bicycle Parking, Breakfast Not Included, Cable TV, Ceiling Fan, Fridge/Freezer, Outdoor Terrace, Parking, 24 Hour Reception, Airport Transfers, Internet Access, Luggage Storage, Restaurant, Tea & Coffee Making Facilities",9.0,10.0
