atmosphere,city,cleanliness,country,description,distance,facilities,kind,location,name,price,rating,rating_cat,reviews,security,services,staff,value_for_money
7.5,Phnom Penh,8.6,Cambodia,"Onederz Phnom Penh is located in the middle of 'riverside' area, which is the most attractive place for tourist. [Room types] We have both dorm rooms and private rooms. We have 4 beds mixed dorm, 4 beds female dorms, 12 beds mixed dorm, 12 beds female dorms and private double room. [Facilities] We have comfortable social space on the ground floor where you can meet many people. We are sure that all of our guests will enjoy great river view from our roof top. In the dorms, Every bed has a personal electronic socket and personal reading light. We also have an air conditioner and a personal locker in your dorm. The shared bathroom for the dorms are out side of the dorms so that you can sleep well without noise from the bathroom. We have a private bathroom in every private room. [Services] You can have breakfast from USD2 in the hostel. We have many services like laundry, towel rental, transportation, tour information and ticket service, etc. We want make your trip something greater, so please ask anything what you need to receptionists. One Stop Hostel is our sister property.  View House Rules  ",2,8.4,Hostel,9.2,Onederz Phnom Penh,US$7.00,8.6,Fabulous,1328,9.1,"Free City Maps, Free Internet Access, Free Parking, Free WiFi, Linen Included, Towels Included, Air Conditioning, Breakfast Not Included, Cable TV, Ceiling Fan, Common Room, Cooker, Elevator, Fridge/Freezer, Hair Dryers, Hot Showers, Key Card Access, Outdoor Terrace, Parking, Reading Light, Safe Deposit Box, Security Lockers, 24 Hour Reception, 24 Hour Security, Housekeeping, Internet Access, Laundry Facilities, Luggage Storage, Tours/Travel Desk, Cafe, Restaurant, Tea & Coffee Making Facilities, Vending Machines, DVD's, Foosball, Games Room",8.7,8.6
,Phnom Penh,,Cambodia,"One Up Banana Hotel Cambodia is Phnom Penh new luxury apartment hotel located in the heart of Phnom Penh BKK1 district. For a luxury stay at Property prices we provide awesome accommodation just a stones throw away from the major sites of Phnom Penh. All rooms are provided with your own flat screen TV with hundreds of Cable channels, a refrigerator, a large double bed and an ensuite shower and bathroom.  Tucked away in a quiet alley, your suite at One Up is just within a short walking distance from Phnom Penh's top-rated bars, restaurants, and shops. Building on our extensive experience with our two nearby properties, One Up is perfectly positioned to make your stay in Phnom Penh a memorable one. You will find our service second to none, all rooms are cleaned each day, there are facilities for food delivery and breakfast on site which makes One Up Hotel Phnom Penh the ideal option for short or long term business stays. We have 13 ensuite rooms and two with balconies overlooking the rooftops of the famous Wat Lanka in BKK1.  The premises are located in the popular tourist area of BKK1 close enough to the night life to be quickly available yet far enough away from it to also be peaceful and relaxing.  View House Rules  ",1.1,,Hotel,,One Up Banana Hotel Cambodia,US$12.00,,No Rating,10,,"Free City Maps, Free Internet Access, Free WiFi, Linen Included, Towels Included, Air Conditioning, Bicycle Parking, Book Exchange, Breakfast Not Included, Cable TV, Ceiling Fan, Hair Dryers, Hot Showers, Outdoor Terrace, Reading Light, Safe Deposit Box, 24 Hour Reception, 24 Hour Security, Airport Transfers, Bicycle Hire, Housekeeping, Internet Access, Late check-out, Laundry Facilities, Luggage Storage, Postal Service, Room Service  (24 hours), Room service (limited hours), Shuttle Bus, Tours/Travel Desk, Wake-up calls, Meals Available, Minibar, Tea & Coffee Making Facilities, Wi-Fi",,
,Phnom Penh,,Cambodia,"Along with all spacious rooms and suites, ultra-tradition Chines-style interior design, Wi-Fi internet throughout all properties, 24-hour front desk, 24-hour security, tour counter, laundry service, airport transfer at the property and a range of in-house facilities. Guests can also enjoy the on-site specialized & famous noodle restaurant. The one and only traditional-branded restaurants and hotels in town are designed to fit any of your traveling demand in both business trips and leisure travel. Cancellation policy: 3 days before arrival. In case of a late cancellation or No Show, you will be charged the first night of your stay. Check in from 14:00-23:00. Check out from 5:00 to 12:00. Hostel accepts Credit Card (Visa/MasterCard) or Cash. Reception working 24 hours. Taxes included. Breakfast with additional cost. No curfew.  View House Rules  ",0.7,,Hotel,,Orussey One Boutique,US$12.00,,No Rating,0,,"Free City Maps, Free Internet Access, Free Parking, Free WiFi, Linen Included, Towels Included, Adaptors, Air Conditioning, Bicycle Parking, Breakfast Not Included, Cable TV, Card Phones, Elevator, Fitness Centre, Fridge/Freezer, Hair Dryers, Hot Showers, Hot Tub, Iron / Ironing Board, Key Card Access, Meeting Rooms, Outdoor Terrace, Parking, Reading Light, Safe Deposit Box, Sauna, Steam Room, Wheelchair Friendly, 24 Hour Reception, 24 Hour Security, Airport Transfers, ATM, Business Centre, Concierge, Currency Exchange, Express check-in / out, Fax Service, Housekeeping, Internet Access, Late check-out, Laundry Facilities, Luggage Storage, Room service (limited hours), Shuttle Bus, Tours/Travel Desk, Wake-up calls, Bar, Café, Meals Available, Minibar, Restaurant, Tea & Coffee Making Facilities, Pool Table, Wi-Fi",,
7.2,Kampot,8.4,Cambodia,"Located just off the Saltworkers Roundabout, The Magic Sponge is just a 5 minute walk from the bus station. The strikingly designed building offers spotlessly clean and spacious air-con or fan rooms with beautiful en-suite toilets, hot showers and sinks. All the beds feature top quality mattresses and pillows for a superb night's sleep in comfort, and all of the rooms have internet LCD TV's up to 48'. The Magic Sponge also has a premium penthouse shared accommodation for groups or individuals seeking the fun of meeting others. The Penthouse has a private sundeck and lounge as well as a beautifully appointed toilet and shower and each bed has a private fan, LED reading light, power point, throw pillow, towel, soap, shampoo, candy and secure storage locker. All of the customers can enjoy free use of our fiber WiFi service as well as our mini golf course, huge 65-inch LCD TV and satellite for live sports, 2 pool tables and internet TV lounge. Additionaly The Magic Sponge has a very active role in Kampot's weekly activities. Its popular bar and restaurant is open all day from 6:15am. Food until 9pm, and bar until midnight.  View House Rules  ",unknown,7.6,Hostel,8.4,The Magic Sponge,US$6.00,8.3,Fabulous,120,9.2,"Free City Maps, Free Internet Access, Free Parking, Free WiFi, Linen Included, Towels Included, Adaptors, Air Conditioning, Bicycle Parking, Book Exchange, Breakfast Not Included, Cable TV, Ceiling Fan, Common Room, Hot Showers, Parking, Safe Deposit Box, Security Lockers, Housekeeping, Internet Access, Laundry Facilities, Luggage Storage, Reception (limited hours), Tours/Travel Desk, Wake-up calls, Bar, Meals Available, Restaurant, Pool Table, Wi-Fi",8.4,8.8
8.0,Kampot,8.0,Cambodia,"Featuring free WiFi throughout the property, The Billabong Guesthouse offers accommodation in Kampot, 2km near Bokor Mountain. The guest house has a year-round outdoor pool with a swim-up bar. Guests can enjoy a meal at the restaurant and free private parking on site. Certain rooms have a seating area to relax in after a busy day. The rooms include a private bathroom fitted with a bath or shower. A TV is available. Our hotel has both Fan and AC fitted rooms. The Reception is opened from 7am to 9pm. Our guesthouse also offers bike hire, VISA/Passport service and bus tickets. If you want to request something specific, you can do that in the next step, before you book. Once you book, we'll provide details so you can contact the property directly.  View House Rules  ",unknown,8.4,Hostel,7.8,The Billabong Guesthouse,US$5.00,8.3,Fabulous,60,8.7,"Free City Maps, Free Internet Access, Free Parking, Free WiFi, Towels Included, Air Conditioning, Breakfast Not Included, Cable TV, Card Phones, Ceiling Fan, Cooker, Cots Available, Fridge/Freezer, Hot Showers, Outdoor Swimming Pool, Outdoor Terrace, Parking, Reading Light, Swimming Pool, Bicycle Hire, Housekeeping, Internet Access, Late check-out, Luggage Storage, Reception (limited hours), Tours/Travel Desk, Bar, Meals Available, Restaurant, Tea & Coffee Making Facilities, Pool Table",8.7,8.4
9.5,Kampot,8.5,Cambodia,"If you are looking for a hostel away from the hustle and bustle, set on the outskirts of Kampot you can leave your worries behind. We are located only 5 mins from the town centre within a quiet Cambodian village and the peacefulness of nature. Our hostel is set in green gardens with flowers and banana trees to a backdrop of mountains, it really is a perfect place to relax in; Co-Work with good wifi connection; chill up in our tree-house whatever works for you. You will be welcomed as family by our staff with a home from home feel, it is a place to chill, share stories, make friends over a game of billiards or a drink in our bar. Should you want to explore further, you can hire a bicycle or scooter and take a trip through the countryside, through the jungle to the unspoiled, beautiful waterfall near by, Bokor mountain, pepper plantation visits and more. Enjoy our Saturday sociable shindig with us with local DJ's, you really are getting the best of both worlds. Each of our bungalows and 'family' rooms have their own en-suite bathroom, and a choice of AC or Fan dorm rooms with great WIFI connection and comfortable beds that will allow for a peaceful nights sleep to the sound of the countryside. Here at The Easy Panda we serve Western and traditional Khmer dishes that are made with locally sourced ingredients, whether it's a taste from home you are wanting or daring to try traditional local flavours, there really is something for everyone!  View House Rules  ",unknown,8.9,Hostel,8.3,The Easy Panda Kampot,US$2.00,9.0,Superb,14,8.3,"Free City Maps, Free Parking, Free WiFi, Linen Included, Towels Included, Bicycle Parking, Breakfast Not Included, Ceiling Fan, Parking, Security Lockers, Bicycle Hire, Internet Access, Reception (limited hours), Tours/Travel Desk, Towels for hire, Bar, Restaurant, Pool Table, Wi-Fi",9.8,9.5
7.6,Kampot,6.0,Cambodia,"Nomad Working Space offers pet-friendly accommodations in Kampot. The guest house has a barbecue and views of the sea, and guests can enjoy a breakfast or a drink at the bar. Free WiFi is featured throughout the property and free private parking is available on site. Certain units have a sitting area to relax in after a busy day. A terrace or balcony are featured in certain rooms. Each room is equipped with a private bathroom. We provide dorm room as well as private room. You will find a 24-hour front desk at the property.You can play pool at this guest house, and bike rental and car rental are available. The nearest airport is Sihanoukville International Airport, 61.2 km from the property. Property Policies & Conditions: 1. Cancellation policy: 2 days before arrival. 2. Check in from 13:00 to 21:00 (exceptional early or late check in is possible). 3. Check out before 12:00 noon. 4. Payment upon arrival by cash. Credit card isn’t accepted. 5. Reception working hours 07:00-23:00. 6. No age restriction. Child friendly. 7. Taxes included. 8. Breakfast not included. 9. Pet friendly. + we have pets.  View House Rules  ",unknown,5.6,Hostel,7.2,Nomad Working Space,US$5.00,6.8,Good,23,6.0,"Free City Maps, Free Internet Access, Free WiFi, Air Conditioning, Breakfast Not Included, Card Phones, Cooker, Elevator, Fridge/Freezer, Outdoor Terrace, Reading Light, Safe Deposit Box, Security Lockers, Housekeeping, Internet Access, Late check-out, Laundry Facilities, Reception (limited hours), Tours/Travel Desk, Towels for hire, Bar, Cafe, Board Games, Pool Table",8.0,7.2
8.7,Kampot,9.3,Cambodia,"Mountain, river and stunning sunset views, clean and comfortable rooms, and a friendly welcome awaits you at Kool Kampot. We love welcoming guests to our home and our town. The guesthouse is in a quiet area and just a short stroll or very short tuk tuk ride to the main area of shops, bars and restaurants. We offer a range of affordable accommodation from a bed in our large air conditioned dormitory with private bathroom to twin air conditioned ensuite rooms. Our dorm beds come with clean linen,  blankets, towels, complimentary toiletries and drinking water, lockers and a personal fan, light and socket. All rooms include bed linen, bath towels, complimentary toiletries, minibar/fridge, closet, desk/chair, in-room safe, complimentary in-room instant coffee/tea and bottled water. En-suite bathrooms are fitted with hot and cold shower facilities. Fast high speed WiFi is available in all rooms and across all of the guesthouse. Our private basic double room with share bathroom comes with ceiling fan (no air-conditioning). Our private superior and standard rooms are all fitted with both air-conditioning and ceiling fans. Kool Kampot also has several indoor, covered and outdoor seating areas with hammocks and sofas dotted around for your relaxation. Or sip a cold drink on our rooftop bar where there’s normally a cool breeze and great views. Breakfast, pool table, tours, buses, scooter hire, luggage storage, large parking area, laundry are among the other services we offer. Everyone at Kool Kampot is available to offer local advice or any other help during your stay that will make it more enjoyable. We look forward to welcoming you into our home away from home.  View House Rules  ",unknown,8.9,Hostel,8.4,Kool Kampot,US$6.00,9.1,Superb,288,9.3,"Free City Maps, Free Internet Access, Free Parking, Free WiFi, Linen Included, Towels Included, Adaptors, Air Conditioning, Bicycle Parking, Book Exchange, Breakfast Not Included, Ceiling Fan, Common Room, Hair Dryers, Hair Dryers For Hire, Hot Showers, Iron / Ironing Board, Outdoor Terrace, Parking, Reading Light, Security Lockers, 24 Hour Security, Airport Transfers, Bicycle Hire, Housekeeping, Internet Access, Laundry Facilities, Luggage Storage, Reception (limited hours), Tours/Travel Desk, Bar, Restaurant, Board Games, Games Room, Pool Table, Wi-Fi",9.6,9.3
9.4,Kampot,7.7,Cambodia,"Welcome to The Yellow Sun hostel and Bungalows! Situated just a short ride from town. We are are brand new hostel situated right on the Kampot river where the surrounding mountains provide an excellent backdrop for guests to see the real beauty that Kampot has to offer.  You can spend the day relaxing on our sun loungers or swim by the river (free tube) or for those a little bit more adventurous we also have kayaks (haft day $4) and scooters available for rent. All of our staff are knowledgeable on the local area and can advise you on all the best sports to visit. At the hostel we also have tuk tuk drivers readily available for those of you who wish to see the sights whilst sitting back and relaxing. They can also take you too and from town, this is a short trip and takes around ten minutes. At night bit lively you can come and join our friendly staff at the bar and enjoy drinks with our happy 6pm- 8pm cocktails or mixed 2 4 1. The sunset over the mountains opposite our pontoon area are beautiful. Yellow Sun provides both private bungalows equipped with balcony's overlooking the river and dorm rooms for whichever is your preference. All of our accommodation has mosquito nets locker and fans to ensure a comfortable stay.  View House Rules  ",unknown,8.4,Bed and Breakfast,8.6,Yellow Sun Hostel,US$4.00,8.7,Fabulous,128,8.4,"Bicycle Parking, Book Exchange, Breakfast Not Included, Washing Machine, 24 Hour Security, Bicycle Hire, Late check-out, Laundry Facilities, Reception (limited hours), Bar, Café, Restaurant",9.2,9.4
8.7,Kampot,9.9,Cambodia,"Ganesha Kampot has been a home away from home for nature lovers since 2012 and we have proudly been a part of creating an authentic vibe with the help of our guests ever since.  Our goal is to offer the most relaxing time, in very beautiful and natural surroundings, in order for our guests to fully enjoy themselves through an organically uplifting environment with a chilled pace.  We are an unusually low density guesthouse, of just 9 private units, 2 private rooms and 2 small dorms, spread across 2 hectare, amid rich mangrove and tropical gardens.Located within the grounds of Ganesha Kampot, Eco Guesthouse and more, our restaurant offers an extensive menu featuring traditional Khmer and international cuisine made with ethically sourced ingredients. We also use our own organic fruits and herbs grown within our luscious tropical garden.We are proud to say we have the largest natural swimming pool of Cambodia overlooking the Bokor mountains and definitely the best spot in Kampot for sunset!  View House Rules  ",unknown,9.4,Bed and Breakfast,8.4,"Ganesha Kampot, Eco Guesthouse and more",US$3.50,9.3,Superb,319,9.6,"Free City Maps, Free Internet Access, Free Parking, Free WiFi, Linen Included, Towels Included, Bicycle Parking, Book Exchange, Breakfast Not Included, Ceiling Fan, Outdoor Swimming Pool, Outdoor Terrace, Parking, Reading Light, Safe Deposit Box, 24 Hour Security, Airport Transfers, Bicycle Hire, Express check-in / out, Internet Access, Laundry Facilities, Reception (limited hours), Bar, Café, Meals Available, Restaurant, Board Games, Wi-Fi",10.0,9.0
8.4,Kampot,8.4,Cambodia,"If you are looking for a happy home from home to chill at for a few days with fantastic food and facilities then look no further.Bohemiaz resorts facilities boast a huge swimming pool, bar, restaurant, gym, Jacuzzi, steam room, sauna and on site spa treatments. Set in the stunning countryside, it's a place where you can mix with locals, expats and travellers in our restaurant and bar, try one of our special cocktails or healthy juice blends, we really do have something for everyone! If you want to relax and take a break from travelling feel free to spend time chilling in a hammock, swimming in the pool or relaxing in the steam room or Jacuzzi or get a massage, manicure or facial from one of our talented therapists.If you want to be a bit more active then work out in our gym, take a yoga class, or borrow one of our bikes to explore the local village.Being situated only 4km from Kampot town, you get the best of both worlds, close enough to pop in when you want but beautifully peaceful and relaxing at the same time. Our bungalows, pool view rooms & dorms are individually designed with en-suites & hot (or cold if you need it at midday!) water showers.Our budget rooms have a shared bathroom with normal showers.We have 2 dedicated 15MB fibre optic lines so great WIFI for anything from browsing to streaming or working.Our Bungalows and pool view rooms all have smart TV's so you can literally search for any movie or TV series and just chill out in bed! We have a huge 18m Natural swimming pool.A natural swimming pool uses no chemicals or salt, instead it is cleaned by a separate filter pool full of plants and a clever filter created using gravel, pipes and tiny holes (my dad can explain it better!) Then there is a natural blue dye in the water which filters the suns rays to stop algae growing. Being a natural pool it is not the same as a chlorine pool, but It's fresh, clean, great for the environment and doesn't hurt your eyes! We serve up great western and Khmer food at Bohemiaz, A real English breakfast with real bacon & cumberland sausages, homemade wraps, Burgers, and plenty of fresh salads, including lots of vegetarian and vegan options, basically all that home comfort or nutritious food you miss from home!We like to think of our menu as a menu where East meets West and healthy and naughty sitting side by side! Yoga is currently not available onsite, however we highly recommend Yoga barn Kampot who have a fantastic range of class styles available twice per day, it's only 200m walk from Bohemiaz and discounts are available for all guests staying at Bohemiaz. We hope to see you soon  View House Rules  ",unknown,9.3,Hotel,7.8,"Bohemiaz Resort, Gym & Spa",US$3.00,8.5,Fabulous,98,8.4,"Free Internet Access, Free Parking, Free WiFi, Towels Included, Adaptors, Book Exchange, Ceiling Fan, Fitness Centre, Hot Showers, Hot Tub, Outdoor Swimming Pool, Outdoor Terrace, Parking, Reading Light, Sauna, Swimming Pool, 24 Hour Security, Beauty Salon, Bicycle Hire, Housekeeping, Laundry Facilities, Luggage Storage, Tours/Travel Desk, Bar, Restaurant, Wi-Fi",8.4,8.9
9.1,Kampot,8.3,Cambodia,"Your home away from home. Our vibe is fun and enthusiastic, yet our standards are of high quality. Enjoy family dinner or a tasty cocktail on our rooftop bar as you watch a stunning sunset over Bokor Mountain. Come and flashpack in style! Our facilities include: - Swimming Pool - Air-con dorms with ensuite and lockers (4-bed/8-bed dorms inside, 6-bed dorms are in poolside converted shipping containers) - Spacious private rooms with AC or fan and ensuite - HOT showers with high water pressure - Rooftop bar with stunning sunrise/sunset views and great cocktails - Restaurant serving breakfast, full lunch menu and dinner - FREE WiFi - Live music and taco’s every Tuesday - Rooftop sports/chill out lounge - Table tennis table - Cinema room - Board games, hammocks and plenty of quiet comfy spots for lazy days - Sunrise yoga area - Free use of slackline - Motorbike - Tours and Information - Long-term rentals available, subject to availability. Here at Karma Traders we’re constantly adding to and improving our facilities to make sure our guests have the best stay possible. Please let us know during your stay if there is anything we can do to improve your experience with us. We are always available to help our guests, no matter the request.  View House Rules  ",unknown,9.2,Hostel,8.0,Karma Traders Kampot,US$3.50,8.8,Fabulous,780,8.9,"Free City Maps, Free Internet Access, Free Parking, Free WiFi, Linen Included, Adaptors, Air Conditioning, Bicycle Parking, Book Exchange, Breakfast Not Included, Card Phones, Ceiling Fan, Common Room, Hot Showers, Outdoor Swimming Pool, Outdoor Terrace, Parking, Safe Deposit Box, Security Lockers, Swimming Pool, 24 Hour Security, Housekeeping, Internet Access, Late check-out, Laundry Facilities, Luggage Storage, Reception (limited hours), Tours/Travel Desk, Towels for hire, Bar, Cafe, Meals Available, Restaurant, Board Games, DVD's, Games Room, Wi-Fi",9.2,9.0
9.3,Kampot,7.7,Cambodia,"Arcadia Backpackers is located just outside of Kampot, in the village of Snam Brampi. Purposefully situated away from the traffic, smells and hassle of the city. We are blessed with picturesque river and mountain views from sunrise to sunset. Arcadia boasts Cambodia’s first true Waterpark featuring a waterslide, russian swing, rope swing, zip-line, blob, climbing wall and kayaks all free to use for staying guests. We also offer activities ranging from riverboat pub crawls to wilderness hiking. Throw in adorable dogs, a ping pong table, pool table, slack-line, home gym, hammocks and chill-out areas for those wanting to relax and stay dry, Arcadia offers something for everybody. ***Property Policies & Conditions: 1. Cancellation policy: 2 days before arrival. 2. Check in from 15:00 to 23:00. 3. Payment upon arrival by cash only. 4. Reception working hours 07:00-22:00. 5. Age restriction: 18+.  View House Rules  ",unknown,9.0,Hostel,8.1,Arcadia Backpackers & Water Park,US$7.00,8.6,Fabulous,511,8.0,"Free City Maps, Free Internet Access, Free Parking, Free WiFi, Linen Included, Bicycle Parking, Book Exchange, Breakfast Not Included, Cable TV, Card Phones, Ceiling Fan, Common Room, Fitness Centre, Outdoor Terrace, Parking, Security Lockers, Towels Not Included, Housekeeping, Internet Access, Late check-out, Luggage Storage, Reception (limited hours), Tours/Travel Desk, Towels for hire, Bar, Restaurant, Games Room, Pool Table, Wi-Fi",9.2,9.1
9.0,Kampot,8.6,Cambodia,"Located upstream from Kampot town, High Tide is the place for chilling out. Surrounded by native greenery and mountains, set on the river with bungalows, dorms, private rooms and hammocks with nets. A full restaurant is available serving up western and traditional khmer dishes, while the bar serves up to 12 pm. Enjoy an amazing sunrise, swim with the glowing plankton at night, and don't forget to look out for the fireflies! Kampot is an amazing place and you will feel right at home during your stay. If you like to chill and relax, you will be in your element. If you're here to explore, we have the perfect adventure for you. We can arrange it all.  View House Rules  ",unknown,8.7,Hostel,9.2,High Tide Kampot,US$3.00,9.0,Superb,198,8.6,"Free City Maps, Free Internet Access, Free Parking, Free WiFi, Linen Included, Towels Included, Adaptors, BBQ, Bicycle Parking, Book Exchange, Breakfast Not Included, Cable TV, Card Phones, Ceiling Fan, Common Room, Elevator, Fitness Centre, Outdoor Swimming Pool, Outdoor Terrace, Parking, Reading Light, 24 Hour Security, Housekeeping, Late check-out, Laundry Facilities, Luggage Storage, Reception (limited hours), Tours/Travel Desk, Wake-up calls, Bar, Cafe, Meals Available, Restaurant, Foosball",9.5,9.3
