atmosphere,city,cleanliness,country,description,distance,facilities,kind,location,name,price,rating,rating_cat,reviews,security,services,staff,value_for_money
9.0,Siem Reap,9.5,Cambodia,"WE ARE OPEN AND RUNNING During these trying corona virus times, we are determined to ensure that our guests are accommodated in a clean, hygienic and safe environment. Our cleaners clean common areas regularly with alcohol and guests are encouraged to wash their hands with hostel-provided liquid soap. HYGIENE AND SAFETY We practice social distancing at the hostel. We ensure that only an optimum number of guests are accommodated in the hostel so that social distancing is maintained. We also serve affordable home-cooked meals for our guests, we provide laundry service and water refills.  As we are aware of the need of guests who are stranded in Cambodia to stretch their dollar, we allow our super-clean kitchen to be used by guests. Currently, we have several guests who buy fresh produce from the local markets and supermarkets and they cook for themselves in our common kitchen. We also have a big common refrigerator for all to use. FOOD DELIVERIES -  We help facilitate food deliveries from the select restaurants in Siem Reap that are still open. The delivery cost is free Unity Hostel is a boutique-themed minimalist hostel which is superbly located on a quiet street (2 minutes from the centre) in the heart of Siem Reap. We maintain an excellent standard of cleanliness as well as high standards of pure comfort. Think; a boutique hotel at hostel rates. Being travelers ourselves, we know what you want - comfortable beds, clean bathrooms, strong showers and affordable rates. There are also an abundance of chill-out spaces for you to create friendships or to just have some alone time. To top it all off, we provide free breakfasts with coffee & tea with 24-hour pantry facilities for all our guests. Our private dorms are the first of its kind in Cambodia; the beds are queen sized in private capsule pods that could accommodate 2 guests. All dormitory rooms are equipped with lockers and lights/power points for each bed. A/C in the dormitory rooms are off automatically between 6.00 am and 9.00 am/ 3.00 pm till 5.00 pm to conserve energy ***Please kindly note that the bunk beds in the Deluxe 6 Bed Mixed Dorm are double-sized and can accommodate two guests at the same time. ***Property Policies & Conditions: 1. Cancellation policy: 1 day before arrival. 2. Check in from 14:00 to 23:00. 3. Check out before 12:00 noon. 4. Payment upon arrival by cash only. 5. Reception working hours 09:00-23:00. 6. Age Restriction:18+. 7. Taxes included. 8. Breakfast included. 9. No pets.  View House Rules  ",unknown,9.3,Hostel,9.9,Unity Hostel,US$0.50,9.4,Superb,84,9.5,"Free Breakfast, Free City Maps, Free Internet Access, Free Parking, Free WiFi, Linen Included, Towels Included, Adaptors, Air Conditioning, Ceiling Fan, Common Room, Dishwasher, Fridge/Freezer, Hair Dryers For Hire, Hot Showers, Outdoor Terrace, Parking, Reading Light, Safe Deposit Box, Security Lockers, Utensils, 24 Hour Security, Airport Transfers, Bicycle Hire, Fax Service, Housekeeping, Internet Access, Laundry Facilities, Luggage Storage, Reception (limited hours), Tours/Travel Desk, Towels for hire, Meals Available, Tea & Coffee Making Facilities, Vending Machines, Board Games, Wi-Fi",9.5,9.3
8.8,Siem Reap,9.4,Cambodia,"Overview If you are looking for a fun, clean, comfortable, well designed and friendly place to stay, One Stop Hostel would be the best choice. One Stop Hostel is a premium hostel located near Pub Street, the best eating and drinking area in Siem Reap. At the hostel, you can meet friends from all over the world at our large common area, enjoy free internet and Wi-Fi access anywhere in the hostel, or relax in our cozy TV room. Our friendly staff will be more than happy to provide you with information about the city. Location Siem reap airport it 20-minute away from One Stop if your flight arrives before 9pm we'll  pick you up for free, we’ve got great location next to the buzzing Pub street, here you can grab some local street food, drinks, cocktails. for a night out head to Angkor night market and Pub street only 1-2 minute away  by foot, this bustling street is filled with bars, restaurants, shopping mall look out for happy hours and clubs that stay open late night, a favorite backpacker haunt. Rooms and Dorms Our mixed dorm and female, spacious shared bathroom, separated by gender, with hot shower Free shampoo, shower gel hairdryer in shared rooms dormitory have Personal electronic socket, personal reading light and mirror, privacy curtains for every bed Large locker with key for every guest, large common area, everyone gets fresh sheets and towels. Extras and activities One stop Hostel has some fun and joyful activities that help you experience and explore more about Cambodia life style both in city and also in the countryside, we have tours everyday sharing with other people to the temple much cheaper than you do private tour, ( Small tour sunrise and grand tour sunset floating village sunset) by tuk-tuk, Ticket and tourist information, Weekend activates (Movie Night, Khmer Language lesson, Khmer family cooking class, BBQ Rooftop Bar), See some of Cambodia's incredible culture on one of our unforgettable.  View House Rules  ",unknown,9.2,Hostel,9.8,One Stop Hostel Siem Reap @ Pub Street,US$6.50,9.4,Superb,2067,9.2,"Free Parking, Free WiFi, Linen Included, Air Conditioning, Bicycle Parking, Breakfast Not Included, Ceiling Fan, Common Room, Hair Dryers, Hot Showers, Outdoor Terrace, Parking, Reading Light, Safe Deposit Box, Security Lockers, Self-Catering Facilities, Washing Machine, 24 Hour Reception, 24 Hour Security, Airport Transfers, ATM, Housekeeping, Internet Access, Laundry Facilities, Luggage Storage, Tours/Travel Desk, Bar, Tea & Coffee Making Facilities, Vending Machines, DVD's",9.7,9.4
9.1,Siem Reap,9.3,Cambodia,"The Hideout is a super social eco-friendly hostel offering excellent value for money, super clean rooms and an awesome atmosphere. Our price includes: - 1 Free ice cold beers each day (7-8PM) - Free Shots @ 9pm - Free Chill-out Room with 100's of movies - Free swimming pool with super comfy bean bags - Free fast wifi throughout our building - Free City Map - Free  use of board games - Free hot showers after check-out - Free luggage storage - Free advice on what to do and see - Free to use computer - Free to use pool table - Free Air conditioning - Tour & Transport booking service - Ultra clean rooms - Friendly helpful staff - Laundry service (Paid) Our ultra modern building provides a large swimming pool surrounded by lush tropical gardens, a chill-out room with hundreds of movies plus our busy hostel bar and restaurant offers super tasty food including a variety of asian dishes, vegetarian options, tasty burgers, and freshly baked pizzas plus happy hours throughout the day. Join us each evening for a few games of pool or giant jenga plus we have event's each day! Water and energy saving features through-out our building include a huge solar system for hot water, energy saving air-conditioning, low cost filtered water dispenser for guest's to cut down on plastic use, no plastic straws, our lighting is low energy and all plastic bottles and cans are recycled. Our high standard rooms are a mixture of dormitories/private rooms and all have air conditioning, are cleaned daily and come with free wifi access. All dormitory rooms are equipped with lockers and lights/power points for each bed. A/C in the dormitory rooms is off automatically between 11am and 5pm to conserve energy  View House Rules  ",unknown,9.5,Hostel,9.0,The Hideout,US$5.00,9.2,Superb,792,8.9,"Free City Maps, Free Internet Access, Free Parking, Free WiFi, Linen Included, Adaptors, Air Conditioning, BBQ, Bicycle Parking, Common Room, Hair Dryers, Hot Showers, Hot Tub, Iron / Ironing Board, Outdoor Swimming Pool, Outdoor Terrace, Parking, Reading Light, Security Lockers, Towels Not Included, 24 Hour Reception, 24 Hour Security, Airport Transfers, Bicycle Hire, Express check-in / out, Housekeeping, Internet Access, Laundry Facilities, Luggage Storage, Shuttle Bus, Tours/Travel Desk, Towels for hire, Bar, Cafe, Meals Available, Restaurant, Board Games, DVD's, Foosball, Pool Table, Wi-Fi",8.9,9.4
8.6,Siem Reap,8.3,Cambodia,"Siem Reap Pub Hostel is located near night market, where you just walk about few minutes to Pub Street area. It is within close proximity of the north of Angkor Night Market. At Siem Reap Pub Hostel, you can meet friends from all over the world at the large common area, enjoy free internet and Wi-Fi access anywhere in the hostel, or relax in our cozy TV room and swimming pool . The friendly staff here will be more than happy to provide you with information about the city and tour arrangement. *Siem Reap Pub Hostel also provides: - Free Breakfast (6:30AM - 10AM) but depend on column that you choose. - Free internet in common area and free Wi-Fi throughout the building - Personal electronic socket, personal reading light and mirror for every bed - Large locker with key for every guest - Free swimming pool for every guest who come to stay in Hostel - Large common area - Spacious shared bathroom, separated by gender, with hot shower - Free shampoo, shower in shared bathrooms - Ticket and tourist information office - Free pick up service(6AM-6PM for private room only)  View House Rules  ",unknown,8.7,Hostel,9.5,Siem Reap Pub Hostel,US$2.50,8.8,Fabulous,1501,9.1,"Free Airport Transfer, Free City Maps, Free Internet Access, Free WiFi, Linen Included, Towels Included, Air Conditioning, BBQ, Breakfast Not Included, Cable TV, Common Room, Cots Available, Dryer, Hot Showers, Iron / Ironing Board, Jobs Board, Safe Deposit Box, Security Lockers, Swimming Pool, Washing Machine, Wheelchair Friendly, 24 Hour Reception, 24 Hour Security, Airport Transfers, ATM, Currency Exchange, Express check-in / out, Housekeeping, Internet Access, Laundry Facilities, Luggage Storage, Postal Service, Shuttle Bus, Tours/Travel Desk, Wake-up calls, Bar, Cafe, Restaurant, Foosball, Games Room, Pool Table, Wi-Fi",8.8,8.9
9.2,Siem Reap,9.7,Cambodia,"Boutique hostel at a backpackers price. Bokre Angkor Hostel provides comfortable accommodations at affordable prices with rooms well-suited for solo travelers, couples, families, groups, and students. Complimentary pick up service is provided from the airport or bus station between the hours of 6:00AM-9:00PM. Please note that any pick up before or after will have a charge $5.00 per tuk tuk. Conveniently located in the heart of Siem Reap, our property is nestled on a lovely and peaceful street away from the bustling downtown area. We are a quick 15 minute walk to the famous Pub Street/ Night Markets. We are also a 15-minute ride to well-known Angkor Archaeological Temples as well as the Siem Reap International Airport. Surrounded by an array of restaurants, cafes, local markets, super markets, and convenience stores, everything you may need is right outside your door. We pride ourselves in creating a relaxing environment, and a home away from home feeling. You will enjoy comfortable rooms, great facilities, and friendly services. We are not a party hostel! Our restaurant serves healthy, locally sourced foods with indoor/outdoor dining options. We also have a full bar serving both alcoholic and nonalcoholic drinks. Enjoy our outdoor jet pool, tropical garden, business center, and free high-speed WiFi throughout our hostel. Our 24 hr front desk staff are more than happy to help you with any information that you may need, and strive to make every guest simply have the best visit to Siem Reap. This property was newly renovated in late 2017, and officially opened in January 2018 by new owners. The business is owned and ran by a small Cambodian family. We are passionate about providing home-like hospitality. We thrive on our guests' heartfelt satisfaction, support of the local community, and care of the environment.  View House Rules  ",unknown,9.6,Hostel,8.9,Bokre Angkor Hostel,US$3.75,9.5,Superb,456,9.6,"Free City Maps, Free Internet Access, Free WiFi, Linen Included, Towels Included, Air Conditioning, Breakfast Not Included, Cable TV, Card Phones, Ceiling Fan, Fridge/Freezer, Hair Dryers, Hot Showers, Outdoor Swimming Pool, Outdoor Terrace, Reading Light, Security Lockers, Swimming Pool, 24 Hour Reception, 24 Hour Security, Airport Transfers, ATM, Bicycle Hire, Express check-in / out, Housekeeping, Luggage Storage, Tours/Travel Desk, Bar, Cafe, Meals Available, Restaurant, Wi-Fi",9.7,9.6
9.2,Siem Reap,9.0,Cambodia,"Mad Monkey Siem Reap has established itself as one of Southeast Asia’s premier social backpacker resorts. With over 100 backpackers staying each night, you'll have no trouble meeting like-minded travelers while sipping cocktails by the sun-drenched pool or playing beer pong at our Rooftop Beach Bar and Restaurant. Located in the center of Siem Reap, we are only a 5 minute walk to the famous Pub Street and 7km from the Angkor Temple complex. Oversized single mattresses with A/C, individual bag lockers, and ensuite bathrooms come standard in our dorms, while our ensuite privates are clean and comfortable. The friendly reception staff can take care of your every need - tours, bus tickets, laundry and visa services - and the chefs in our rooftop restaurant will cook you a variety of Khmer and Western food that will dance across your tongue. Expect free shots, table dancing, nightly events, good music and great company at the rooftop bar as the party charges towards midnight when we head off to Pub Street to dance the night away. To top all this off, your stay at Mad Monkey contributes to the local community. All of our staff are paid fair wages and receive benefits. Your booking also helps fund education projects and build water wells for Cambodia's rural communities. We can't wait to meet you! Age restriction: 18+.  View House Rules  ",unknown,9.2,Hostel,9.6,Mad Monkey Siem Reap,US$5.00,9.2,Superb,3362,9.2,"Free City Maps, Free Internet Access, Free Parking, Free WiFi, Linen Included, Towels Included, Air Conditioning, Bicycle Parking, Book Exchange, Breakfast Not Included, Ceiling Fan, Common Room, Hair Dryers For Hire, Hot Showers, Iron / Ironing Board, Outdoor Swimming Pool, Outdoor Terrace, Reading Light, Security Lockers, Swimming Pool, Utensils, 24 Hour Reception, 24 Hour Security, ATM, Bicycle Hire, Housekeeping, Internet Access, Late check-out, Laundry Facilities, Luggage Storage, Tours/Travel Desk, Towels for hire, Bar, Meals Available, Restaurant, Wi-Fi",9.2,9.3
9.1,Siem Reap,9.7,Cambodia,"If you are looking for a clean, comfortable, well designed and friendly place to stay, Onederz Hostel Siem Reap would be the best choice. It is a premium hostel with swimming pool located next to Angkor Night Market, and also 4 minutes walk from Pub Street. At the hostel, you can meet friends from all over the world at our large common area including swimming pool, enjoy free internet and Wi-Fi access anywhere in the hostel, or relax in our cozy TV room. Our friendly staff will be more than happy to provide you with information about the city. Onederz Hostel Siem Reap is our second hostel in Siem Reap and our fourth hostel in Cambodia. We also have hostels in Sihanoukville and Phnom Penh. ***Property Policies & Conditions: 1. Check in from 14:00 and check out before 12:00 noon. (1) We strictly require a passport at check-in. (2) Late check-outs will be charged for an additional night. 2. Payment is due upon arrival by cash only, please. 3. Cancellation policy: At least 1 day advance notice before the arrival date is required. 4. Room rates do not include breakfast. - Breakfast is available as cheap price in our restaurant.  View House Rules  ",unknown,9.6,Hostel,9.9,Onederz Hostel Siem Reap,US$8.00,9.6,Superb,3817,9.7,"Free City Maps, Free Internet Access, Free Parking, Free WiFi, Linen Included, Towels Included, Air Conditioning, Bicycle Parking, Breakfast Not Included, Cable TV, Ceiling Fan, Common Room, Dryer, Hair Dryers, Hair Dryers For Hire, Hot Showers, Key Card Access, Outdoor Swimming Pool, Outdoor Terrace, Parking, Reading Light, Safe Deposit Box, Security Lockers, Self-Catering Facilities, Swimming Pool, Washing Machine, 24 Hour Reception, 24 Hour Security, Airport Transfers, ATM, Bicycle Hire, Fax Service, Housekeeping, Internet Access, Laundry Facilities, Luggage Storage, Tours/Travel Desk, Towels for hire, Bar, Cafe, Meals Available, Restaurant, Tea & Coffee Making Facilities, Vending Machines, Board Games, DVD's, Wi-Fi",9.6,9.5
9.0,Siem Reap,9.6,Cambodia,"The largest, newest and most modern hostel in the centre of Siem Reap! Just a 5 minute walk to the famous Pub Street, and even less time to walk to the Siem Reap River and Old Market. After creating Lub d Phuket, voted the “Best New Hostel in the World 2017” “Best Hostel in Thailand 2018” and “Best Extra Large Hostel in the World 2018”, Lub d has opened the most talked about property in Siem Reap, thanks to an amazing design, team, atmosphere, and facilities that have to be seen to be believed. Lub d Siem Reap offers a Khmer-chic inspired property design, including a swimming pool with swim-up pool bar, great lounging areas throughout the common area, games area including pool table and old school Pacman arcade game. We have all-day breakfast, delicious barista-made espresso coffee and a-la-carte dining at The PumpHouse, plus our Grab N’ Go counter for snacks. Join our dedicated guest activities team for one of our exciting activities, and book a tour to the famous Angkor Wat temples or an exciting adventure tour to the Cambodian countryside at our Adventure Travel Co. tour desk. If you’re a digital nomad, blogger, entrepreneur, or just in need of a working space while you travel, everything you need is right here at our co-working space! We have 24-hour reception and security, elevator access for all rooms, and tuk tuk drivers on stand-by to get you around town. Whether it’s our spacious, premium 10-bed dorms, king or twin junior rooms, or even connecting rooms for family or friends, we’ve got you covered! Our spectacular dorm rooms are not just spacious, but a separate locker and change area within the room keeps noise and light to a minimum in your sleep area, plus large shared bathrooms that are even equipped with hair dryers and straighteners. Seriously, the best dorms in Siem Reap! If you need privacy, our junior rooms provide all the important amenities you need! Junior rooms feature private bathrooms, mini-fridge, tea & coffee, safety box, smart TV, excellent air-conditioning, super comfy mattresses and top of the line linen and pillows.  View House Rules  ",unknown,9.6,Hostel,9.6,Lub d Cambodia Siem Reap,US$9.50,9.4,Superb,1323,9.6,"Free City Maps, Free Internet Access, Free Parking, Free WiFi, Linen Included, Towels Included, Air Conditioning, Bicycle Parking, Book Exchange, Breakfast Not Included, Card Phones, Common Room, Dryer, Elevator, Hair Dryers, Hot Showers, Iron / Ironing Board, Key Card Access, Meeting Rooms, Outdoor Swimming Pool, Outdoor Terrace, Parking, Reading Light, Safe Deposit Box, Security Lockers, Swimming Pool, Washing Machine, Wheelchair Friendly, 24 Hour Reception, 24 Hour Security, Airport Transfers, Bicycle Hire, Fax Service, Housekeeping, Internet Access, Late check-out, Laundry Facilities, Luggage Storage, Tours/Travel Desk, Wake-up calls, Bar, Cafe, Meals Available, Mini-Supermarket, Restaurant, Tea & Coffee Making Facilities, Board Games, DVD's, Foosball, Games Room, Pool Table, Wi-Fi",9.2,9.5
8.9,Siem Reap,9.5,Cambodia,"Situated on 16th Avenue in the heart of Central Siem Reap, The Twizt Lifestyle Hostel is right in the middle of all the fun! The innovative “lifestyle hostel” is a social community space where guests interact and socialize with one another, making memories which will last a lifetime. In addition, Twizt also provides comfortable and modern accommodation at very affordable rates. Just a few minutes away from the popular areas of Pub Street and the Heritage Walk Mall lies Twizt, a stylish and visually appealing hostel which is popular with a wide range of travelers. Whether you’re hitting the local clubs or exploring the ancient ruins, Twizt is the perfect hub to do it from. The building has been completely renovated and restored to its old colonial façade, evoking a sense of history while remaining fiercely modern and progressive inside. This dichotomy of the old meeting the new is what makes Twizt so popular with all kinds of travelers from all walks of life. It doesn’t matter if you’re a family, solo traveler, or a businessperson – Twizt is not like a normal hostel. If you’re looking to explore Siem Reap, the archaeological Angkor complex, and Khmer civilization, look no further than Twizt!  View House Rules  ",unknown,9.4,Hostel,9.4,The Twizt Lifestyle Hostel,US$10.00,9.3,Superb,68,9.7,"Free Parking, Free WiFi, Linen Included, Towels Included, Adaptors, Air Conditioning, Bicycle Parking, Breakfast Not Included, Common Room, Dryer, Elevator, Hair Dryers, Key Card Access, Outdoor Swimming Pool, Outdoor Terrace, Parking, Safe Deposit Box, Security Lockers, Swimming Pool, Wheelchair Friendly, 24 Hour Reception, 24 Hour Security, Airport Transfers, Bicycle Hire, Currency Exchange, Housekeeping, Internet Access, Late check-out, Luggage Storage, Postal Service, Shuttle Bus, Tours/Travel Desk, Towels for hire, Wake-up calls, Bar, Cafe, Meals Available, Restaurant, Tea & Coffee Making Facilities, Vending Machines, Board Games, Games Room, Wi-Fi",9.4,9.2
,Siem Reap,,Cambodia,"For your ultimate stay in Siem Reap, The Dinata Angkor Boutique offers 28 spacious, comfortable with Deluxe Pool views and City view rooms, each are Cambodian stylishly decorated. All our rooms are equipped with modern amenities for your convenience, and the Dinata Angkor swimming pool area provide the ideal environment for our guests to relax after a long day of visiting Siem Reap's world famous temples. Dinata Angkor is located in the heart of the city just 06 minutes walk to Pub Street, Old Market & Night Market, All are well known to Siem Reap's international travellers. The Old Market and Night Market offer a unique souvenir shopping experience, While Pub Street offers the best in entertainment, foreign and Khmer Food and Vibrant night life. Let Dinata Angkor help you to experience the natural beauty of Cambodia and to explore Cambodia's enchanting people and ancient, culture.  View House Rules  ",unknown,,Hotel,,Dinata Angkor Boutique Hotel,US$15.00,,No Rating,0,,"Free Breakfast, Free City Maps, Free Internet Access, Free Parking, Free WiFi, Towels Included, Air Conditioning, Book Exchange, Cable TV, Card Phones, Cots Available, Dryer, Elevator, Fridge/Freezer, Hair Dryers, Hot Showers, Hot Tub, Iron / Ironing Board, Key Card Access, Outdoor Swimming Pool, Parking, Safe Deposit Box, 24 Hour Reception, 24 Hour Security, Airport Transfers, ATM, Bicycle Hire, Business Centre, Currency Exchange, Direct Dial Telephone, Housekeeping, Internet Access, Late check-out, Laundry Facilities, Luggage Storage, Postal Service, Reception (limited hours), Tours/Travel Desk, Wake-up calls, Bar, Café, Meals Available, Mini-Supermarket, Minibar, Restaurant, Tea & Coffee Making Facilities",,
,Siem Reap,,Cambodia,"SR Orkide Boutique is an elegant and luxurious villa accommodation located close to Angkor, one of the world’s most famous archaeological sites. SR Orkide Boutique is a traditional nature retreat set in a peaceful place have to offer. Designed as a home away from home, personalized and professional hospitality is at the heart of all that staff offer its guests. Its facilities and services are comprehensive and guaranteed to satisfy guests who expect the best. We offer private rooms and long-stay rooms. All rooms are clean and spacious and include high-quality daily room services, complimentary wireless Internet access, bathrobes, slippers, bottled water, and bathroom accessories. The Decor is a traditional Khmer style with contemporary elements and elegant accents. Property Policies: Cancellation policy: 3 days before arrival day. In case of a late cancellation or No Show, you will be charged the first night of your stay. Check in from 14:00 to 23:00 . Check out from 06:00 to 12:00 . Payment upon arrival by cash. Taxes included. Breakfast not included. No curfew. Child friendly. No smoking in room ($50 fine if found of smoking in the room), pet are not allow and all of our rooms are Non-smoking room, but there is an area at our garden to smoke.  View House Rules  ",unknown,,Hotel,,SR Orkide Boutique,US$5.00,,No Rating,0,,"Free City Maps, Free Parking, Free WiFi, Linen Included, Towels Included, Air Conditioning, Breakfast Not Included, Cable TV, Fridge/Freezer, Hair Dryers, Hot Showers, Reading Light, Swimming Pool, 24 Hour Reception, 24 Hour Security, Airport Transfers, Bicycle Hire, Concierge, Express check-in / out, Housekeeping, Late check-out, Laundry Facilities, Luggage Storage, Shuttle Bus, Tours/Travel Desk, Meals Available, Tea & Coffee Making Facilities, Pool Table, Wi-Fi",,
