atmosphere,city,cleanliness,country,description,distance,facilities,kind,location,name,price,rating,rating_cat,reviews,security,services,staff,value_for_money
9.1,Koh Phangan,7.9,Thailand,"Welcome to OmGanesh Hostel & Indian Restaurant For travelers who want to take in the sights and sounds of Koh Phangan, Om Ganesh Hostel is the perfect choice. From here, guests can enjoy easy access to all that the lively island has to offer. When you book with OmGanesh Hotel every body get on full moon party nigh free bucket  and Body Paint! The ambiance of Om Ganesh Hostel is reflected in every guestroom: Free Wi-Fi, Safety Deposit Boxes, Tea & Coffee, drinking water, Full Air-conditioned dorms with additional wall fans and luggage storage, Wide Mattresses, Personal Reading Light & Separation Curtain, . free sang some vodka bucket and body paint on full moon night, Located in the centre of Haad Rin village just 2 minutes walk from Haad Rin world Famous FullMoon Party and Haadrin beautiful beach. We are ideally situated for your Koh Phangan Experience. We also have a fantastic indian restaurant serving the finest Indian Cuisine on the Island.  View House Rules  ",unknown,8.1,Hostel,9.9,Om Ganesh Hostel,US$3.09,9.0,Superb,445,9.1,"Free City Maps, Free Internet Access, Free Parking, Free WiFi, Towels Included, Air Conditioning, Bicycle Parking, Breakfast Not Included, Cable TV, Ceiling Fan, Hot Showers, Linen Not Included, Outdoor Terrace, Parking, Reading Light, Safe Deposit Box, Security Lockers, 24 Hour Reception, 24 Hour Security, ATM, Fax Service, Internet Access, Late check-out, Laundry Facilities, Luggage Storage, Wake-up calls, Restaurant, Tea & Coffee Making Facilities, Wi-Fi",9.8,9.3
7.8,Koh Phangan,8.8,Thailand,"The Cage Hostel opens officially 9 of November 2019. We are located in the centre of Haad Rin, 250 metres from the fullmoon party beach, 350 metres from Leela beach. 150  metres from haadrin pier, and a few mins drive to other festivals. We aim to be a  social hostel and provide an unique atmosphere, where our guest can relax hang out get new friends, pre party for fullmoon, ore just relaxing with a coctail ore coffe after spending time on the beaches ore going to adventure. We have a big selection of board games, we organised pre parties before the fullmoon party and other occasions, we sell drinks for very reasonable prices. All of our rooms and dorms have air condition, personal  lockers, hot water, reading lights and electric socket at every bed. We have an coffee shop/ bar on site,  Motorbike rental and tour agency. Property Policies & Conditions Check in - 14.00 Check out - 11.00 Reception 07.00 - 24.00 No smoking in room but we have smoking area Breakfast not included We accept only guests at the age of 18 year-old or more  View House Rules  ",unknown,7.6,Hostel,9.4,The Cage Hostel,US$4.94,8.6,Fabulous,10,8.4,"Free WiFi, Linen Included, Air Conditioning, Common Room, Hair Dryers, Hot Showers, Key Card Access, Microwave, Outdoor Terrace, Parking, Reading Light, Safe Deposit Box, Security Lockers, 24 Hour Security, Housekeeping, Internet Access, Laundry Facilities, Reception (limited hours), Tours/Travel Desk, Towels for hire, Wake-up calls, Bar, Cafe, Tea & Coffee Making Facilities, Board Games, Wi-Fi",8.8,9.2
7.2,Koh Phangan,6.0,Thailand,"Asia Blue - Beach Hostel Hacienda is not a typical hostel; It’s a tropical paradise paired with a perfect blend of relaxation and a party atmosphere. We have the amenities and services of a resort, prices of a hostel and an amazing vibrant team who will make you feel right at home. You won’t want to leave. We provide 2 dorm rooms, some budget private rooms with fan and private A/C room for more relaxation. Weekly activities: Volleyball,  FREE yoga, beer pong tournament, Pool party, Beach clean-up and MORE!! Want to go to the Full Moon party or Half-moon Party or Jungle Party or the awesome Waterfall Party? We have the best Party Packages and pre-drinks party (ALL you can eat and DRINK), transportation and more. Our beach hostel is everything you need and ideal for every type of traveler. Beach lovers will enjoy lounging on a sunbed and look out to sea. If you prefer to hangout pools We have staff that speak English, Thai, French and Spanish. Things to note 1) Check in from 14:00 2) Check out Before 10:30 3) Reception working hours: 7:00 – 21:00 If you will arrive at the hostel after 21:00, please let us know in advance. Curfew after 23:00. 4) Payment on Arrival: Cash and credit card Credit card payment will have 5% surcharge. 5) Cancellation or amendment must be made 7 days in advance prior to arrival. 6) Breakfast is not included 7) NO smoking in Room, but have smoking area 8) Please note SOME rooms has not air-con only FAN. Please make sure before making a reservation. 9) We only accept guests at the age of 18 years old or more. 10) By Thai law, re required a photocopy of your passport as well as a copy of your departure card (TM6). These documents are required at check-in. Please ensure to have these documents ready at check-in and safeguard throughout your travels.  View House Rules  ",unknown,7.1,Hostel,8.7,Asia Blue Beach Hostel Hacienda,US$4.60,7.3,Very Good,26,7.2,"Free WiFi, Linen Included, Adaptors, Breakfast Not Included, Ceiling Fan, Hot Showers, Outdoor Swimming Pool, Outdoor Terrace, Parking, Security Lockers, Swimming Pool, Housekeeping, Luggage Storage, Reception (limited hours), Tours/Travel Desk, Bar, Restaurant, Wi-Fi",7.5,7.6
9.0,Koh Phangan,8.3,Thailand,"Shiralea Backpackers Resort is just that – it combines the tropical tranquility of a resort with the prices and night-time atmosphere that any backpacker would look for in accommodation. - ACCOMMODATION – Our accommodation types range from our air-conditioned private bungalows with hammock & en-suite, to our world-class hostel dorms for the social backpacker type. Our hostel comprises of several air-conditioned dorms with 8 private ‘pods’ in each. Each pod has a spacious & lockable closet that can easily store an entire backpack with spare room to hang clothes. Features include a reading light, a wall socket for electronics, and a privacy curtain to make your stay as comfortable as possible. - ATMOSPHERE – The resort swings from a lazy day-time vibe to an upbeat nightlife of paint parties and beer pong, catering to our regular crowd of jovial, fun-loving travelers. We welcome people of all ages, cultures, and walks of life, as there is something for everyone here whether you are looking to party or relax. - FACILITIES – Come relax by the pool with a cocktail from the bar or chill out in the restaurant’s shaded area with a good book where we have a large selection of high quality Thai, Western, and fusion food for you to choose from. There is 24 hour access to our modern swimming pool, the pool table, and free WiFi throughout the resort. We are located a short 3 minute walk from Haad Yao beach, and our friendly team will help you organize any activities you would like to do during your stay on Koh Phangan. ****Attention Customer: Unfortunately, the individual room facilities can not be seen on the Hostelworld mobile app, so please see the descriptions below******* Standard Double (sleeps 1-2 people) - 1 x double bed (hotel grade mattress) - rotating ceiling fan - built in closet - safety box - private bathroom - mosquito nets on the windows - private balcony equipped with Thai hammock - garden view. Standard Twin (sleeps 1-2 people) - 2 x single beds (hotel grade mattresses) - rotating ceiling fan - built in closet - safety box - private bathroom - mosquito nets on the windows - private balcony equipped with Thai hammock - garden view. Deluxe Family Room (sleeps 1-4 people) - 2 x king size beds - AirCon - large private bathroom - safety box - private balcony with Thai hammock - well spaced out across the grounds w/ pool or garden views. Superior Family Room (sleeps 1-4 people) - larger room w/ 2 x king size beds - AirCon - large private bathroom - safety box - private balcony with Thai hammock - lovely garden view from large double glass doors.  View House Rules  ",unknown,9.0,Hostel,9.0,Shiralea Backpackers Resort,US$4.64,9.1,Superb,640,9.3,"Free City Maps, Free Parking, Free WiFi, Linen Included, Towels Included, Air Conditioning, Bicycle Parking, Book Exchange, Breakfast Not Included, Cable TV, Ceiling Fan, Common Room, Hot Showers, Outdoor Swimming Pool, Outdoor Terrace, Parking, Reading Light, Safe Deposit Box, Security Lockers, Swimming Pool, Fax Service, Housekeeping, Laundry Facilities, Luggage Storage, Reception (limited hours), Tours/Travel Desk, Bar, Meals Available, Restaurant, Tea & Coffee Making Facilities, Board Games, Pool Table, Wi-Fi",9.6,9.4
8.2,Koh Phangan,8.3,Thailand,"One Trinity Hostel is situated at heart of Haad Rin Beach/Koh Phangan. just few minutes away from the white sandy haad rin Beach and Legendary Full moon Party and not too close to the Loud bars and Music for a good nights Sleep Facilities include: - Fully air conditioned dorms of various sizes. - Breakfast (9 am till 12am) only during full moon - Plug socket , reading light , privacy curtains ,Safety boxes ( please bring your own padlocks), Blankets for each bed - super cheap drinks on full moon night and warm up parties on party occasions **Property Policies & Conditions: 1. Food , drinks and friends not allowed in the dorms 2. Check in not later than 18:00 pm. - Room & Key deposit passport (will be returned at check out time in normal condition) 3. Check out before 11:00 am ( Flexible upon request), Late check out will be charged for a night 4. Payment conditions and cancellation policy * Cancellation 14 days before arrival , no charge , after that bookings will be charged for 1 night BE RESPONSIBLE AND PARTY HARD !!!!  View House Rules  ",unknown,8.0,Hostel,9.2,One Trinity Hostel,US$12.52,8.5,Fabulous,79,8.4,"Free Breakfast, Free City Maps, Free Internet Access, Free WiFi, Linen Included, Towels Included, Air Conditioning, Bicycle Parking, Ceiling Fan, Common Room, Cots Available, Hot Showers, Meeting Rooms, Outdoor Swimming Pool, Outdoor Terrace, Reading Light, Safe Deposit Box, Security Lockers, Swimming Pool, 24 Hour Reception, 24 Hour Security, Housekeeping, Internet Access, Late check-out, Laundry Facilities, Postal Service, Reception (limited hours), Tours/Travel Desk, Wake-up calls, Meals Available, Tea & Coffee Making Facilities",8.9,8.3
9.1,Koh Phangan,9.5,Thailand,Our brand new hostel is really and highly female oriented and recommended. Our 12 bed dorm is 100% female. Our private rooms can be booked by men. But be aware that our goal is to satisfy women first. Check our choice of breakfast : We are happy and proud that our breakfast at Beach Coconut are rated number one on Trip Advisor. At the bar near the swimming pool we offer cheaper option. We serve good quality of food from 9 am til 9 pm. We also own the only tennis court on the island. Ladies get discount to book the tennis and also get discount on the private and group lessons. Important notice: For the Full Moon and peak period bookings & payments are NON-REFUNDABLE and need to be paid in advance via PayPal .  View House Rules  ,unknown,9.5,Hostel,9.3,KAUAI,US$5.52,9.5,Superb,130,9.7,"Free City Maps, Free Internet Access, Free Parking, Free WiFi, Linen Included, Air Conditioning, Bicycle Parking, Book Exchange, Breakfast Not Included, Common Room, Hot Showers, Microwave, Outdoor Terrace, Parking, Security Lockers, Swimming Pool, Towels Not Included, Bicycle Hire, Housekeeping, Internet Access, Late check-out, Luggage Storage, Reception (limited hours), Tours/Travel Desk, Towels for hire, Bar, Cafe, Meals Available, Restaurant, Board Games, Wi-Fi",10.0,9.5
8.8,Koh Phangan,8.1,Thailand,"Sarana Bungalows is located on a beautiful, peaceful beach on Koh Phangan and is only a few minutes away from the half and full moon parties! We have Twin, Double, Triple, Quad and dorm rooms available. All rooms have air conditioning and ensuites with hot water. Our friendly Thai and Western staff will make sure that you have an amazing time. And whether you want to relax, party or explore the island, Sarana Bungalows is the perfect place to stay on Koh Phangan. - Relax by our amazing pool with a cocktail. - Chill out in a hammock and use the free WiFi. - Get a massage on the beach. - Go snorkelling, kite surfing or sea kayaking. - Visit one of the nearby waterfalls or go elephant trekking in the jungle. - Party at the world famous full moon party, which is only 10 minutes away. - Enjoy delicious Thai or Western food at our restaurant.  - Feel safe and secure. We've got CCTV and staff on site 24 hours a day. - Get help to book onward travel from our friendly Thai and Western staff. - Play with our fur babies, Dave, Rosie & Bob - they love cuddles! 1.Our check in time is 13:00p.m and check out time is 11:00a.m. 2.14 days notice for free cancellation. 3.We accept cash or credit card payment upon arrival. 4.Reception is open from 9am-9pm. 5. Early check outs and free luggage storage is available. 6. We are TAT Licensed and can help you to book any onward travel. 7. Our resort is not suitable for children aged under 12. Please note: Reception is open from 9am to 9pm. If you are arriving outside of these hours please call us.  View House Rules  ",unknown,8.6,Hostel,9.1,Sarana Bungalows,US$6.18,8.9,Fabulous,178,9.1,"Free City Maps, Free Internet Access, Free Parking, Free WiFi, Linen Included, Towels Included, Air Conditioning, BBQ, Bicycle Parking, Book Exchange, Breakfast Not Included, Ceiling Fan, Fitness Centre, Hair Dryers, Hair Dryers For Hire, Hot Showers, Iron / Ironing Board, Outdoor Swimming Pool, Parking, Safe Deposit Box, Security Lockers, Swimming Pool, 24 Hour Security, Airport Transfers, Housekeeping, Laundry Facilities, Luggage Storage, Reception (limited hours), Tours/Travel Desk, Bar, Cafe, Meals Available, Restaurant, Board Games, Games Room, Wi-Fi",9.2,9.1
8.4,Koh Phangan,6.7,Thailand,"Happy Hour all day every day - vodka whisky buckets 100THB *****  Just confirmed Jaya Party Hostel will now be holding even more crazy warm up parties with live DJs from the world famous jungle party playing on various nights over the full moon period in the hostel bar.... more info coming soon so watch this space!! LOCATION: Perfectly situated in the centre of Haadrin and roughly 1 minute away from the Full Moon Party and just a little bit further to the other 2 amazing beaches in the area.  There a lots of shops, ATM's, banks, bars, hairdressers, tattooists, massages, restaurants and much more within no more than a 5 minute walk to anything in Haadrin, plus there is also a pier 30 seconds walk from th hostel which has 4 boats daily to Koh Samui daily.  Location is everything and Haadrin is really the only place to be at Full Moon. WHAT TO EXPECT: Fun, laughter, excitement and killer hangovers............ We are a Party Hostel and we actively encourage you to rock out, enjoy yourself, make friends and lay it all the line......... go hard or go home.  If you’re just looking for a place to crash and not socialise then we are probably not the place for you.  Although we have no reservations at all that some of our guests choose to stay in the hostel bar most if not all of the day drinking and getting properly on it during the day we actively encourage you to go out and explore this magical island, hangovers aren't the end of the world and just come and ask us some of the best ways to enjoy your time on Koh Phangan, we can arrange for a large scooter tour of some of the best spots on the island for those of you who check in early enough and want to explore a little bit before the real mayhem starts and we will even do it with you so you will get your own personal tour guide at no cost!!  And we all know we all like free stuff while travelling :) ACCOMODATION: We have a selection of different size dorms and private rooms available, from double and twin private rooms, 4, 10, 14 and 19 bed dorms.  All of our rooms and dorms are fully air conditioned with either en-suite or shared bathrooms with hot showers.  All rooms and dorms are cleaned twice daily however we would like you to let us know at any time if your room needs an extra clean/tidy or if there are any problems with your room so we can rectify it straight away for you.  You will be given fresh towels and blankets daily and should you need more or extra you just have to ask.  The blanket we give you is large and can easily fit over two people and is made from the towel material, they are all fresh, clean and soft for extra comfort THE BAR: This is where you will spend most of your time, our newly refurbished bar and restaurant is a great place to socialise.  It's huge and stacked out with comfy chairs and sofas so you can chill, relax, eat and drink with your new friends.  We constantly play killer drinking games but for those who just want to sit back and soak up the atmosphere while getting in the party mood there is more than enough room for everyone to feel at home.  However things tend to get out of hand pretty quickly so don't be surprised if you plan just to by yourself for a little while nursing last night’s hangover only to find you get dragged into a game of beer pong or ring of fire within a few seconds of sitting down.  We also have a free pool table and massive big screen TV with netflix and live sport and movies galore. The atmosphere tends to be pretty chill during the day but come night time we have a warm up party each night before each event over full moon so our bar trans-forms into a mini nightclub, cheap strong buckets plus a few vodka joss shots will get you in the mood along with an abundance of free uv body paint which will get you in the party spirit.  There will be great tunes blasting from the speakers and plenty of tables to dance on, we encourage you to do all of this!!! Like everywhere on Koh Phangan we have a minimum stay during full moon, however all other dates during the month including Half Moon you can now stay with us with no minimum stay required and our bar is great for pre-gaming before all the nightly parties such as HALF MOON, WATERFALL, EDEN, GUYS BAR, LOST PARADISE, LIGHTHOUSE AND LOI LAY. Most of you are coming to Koh Phangan to party and you won’t be disappointed, but should you wish to take a break from the many crazy party events then fear not as Koh Phangan is home to one of the world’s largest Yoga communities and away from the parties you will find some of Thailand's most stunning beaches, epic viewpoints, quirky night markets and some of the best tasting vegan food you are likely to find, so if you’re looking to chill then Haadrin is a great place to be when visiting the island when it’s not Full Moon as it super quiet and relaxed but you will still have the option to party should you feel in the spirit after a relaxing day at one of the many great areas the island has to offer and we at Jaya will happily give you a detailed run down of all the places you might want to hit up depending on what you’re looking for. FULL MOON Best day to arrive: We RECOMMEND that you arrive four nights before the Full Moon Party, as it’s a week-long festival rather than a single night of fun.  A good majority of people also believe that the parties leading up to the main event are even better than the Full Moon party itself! Allow yourself to fully enjoy the full moon by NOT checking out the morning after. The party goes until after sunrise, followed by an many after parties!!. We provide towels, lockers, filtered drinking water, however you will need to provide your own padlock for the lockers. All common areas and lockers under CCTV surveillance for the security of our guests and their belongings. Extras: We operate a travel and tour service also so anything you wish to do we can happily arrange for you with tickets at a discounted rate for our guests and pick up from the hostel. Please contact us prior to your stay via our facebook page or by email/phone for information and great discounts on any number of the tours available to choose from on Koh Phangan.  We offer the best discounts for Angthong National Marine Park if that is something you are looking to do during your time on this side of thailand. And of course so you can stay in touch with you friends there is free Wifi, but we suggest you spend most of your time making friends and having fun. Directions: Haadrin Pier ~ short 30 second walk from the pier taking the first left the first right Tongsala Pier ~ We suggest taking one of the many shared taxis to Haadrin and should cost no more than 100THB  View House Rules  ",unknown,7.6,Hostel,9.5,Jaya Party Hostel,US$8.50,8.2,Fabulous,515,7.9,"Free City Maps, Free City Tour, Free Internet Access, Free Parking, Free WiFi, Linen Included, Towels Included, Air Conditioning, Bicycle Parking, Book Exchange, Breakfast Not Included, Cable TV, Ceiling Fan, Common Room, Hair Dryers, Hot Showers, Outdoor Terrace, Parking, Safe Deposit Box, Security Lockers, Utensils, 24 Hour Security, ATM, Currency Exchange, Express check-in / out, Fax Service, Housekeeping, Internet Access, Internet café, Late check-out, Laundry Facilities, Luggage Storage, Postal Service, Reception (limited hours), Tours/Travel Desk, Wake-up calls, Bar, Cafe, Meals Available, Mini-Supermarket, Restaurant, Tea & Coffee Making Facilities, Board Games, DVD's, Games Room, Nightclub, Pool Table, Wi-Fi",8.9,8.2
