atmosphere,city,cleanliness,country,description,distance,facilities,kind,location,name,price,rating,rating_cat,reviews,security,services,staff,value_for_money
6.5,Koh Phangan,8.0,Thailand,"The resort is designed to recall a charming Southern Thai-style bungalows and each bungalow comes with choices of fan or air-conditioning, TV and a dressing table, bathrooms amenities. Situated on the western side of the island is Haad Yao Bayview Resort. The tranquil resort in backed by lush green forest and fronted by the glorious white sand beach of Haad Yao. Just a one minute walk from the soft sand and Warm water, guest are in true paradise. Haadyao Bayview Resort & Spa offers a choice of comfortable accommodations for discerning travelers. Haad yao Bay View Resort & Spa offers a choice of comfortable accommodations for discerning travelers. Cancellation policy, If cancelled up to 30 days before date of arrival , no fee will be charged. If cancelled or modified later or in case No Show , the total price of the reservation will be charged. *The hotel will charge credit card full of reservation  in advacne during full moon party*  View House Rules  ",unknown,8.0,Hotel,8.5,Haad Yao Bay View Resort & Spa,US$9.27,7.9,Very Good,47,8.5,"Free Parking, Free WiFi, Air Conditioning, Cable TV, Cots Available, Meeting Rooms, Outdoor Swimming Pool, Parking, Safe Deposit Box, Swimming Pool, 24 Hour Security, Airport Transfers, ATM, Bicycle Hire, Currency Exchange, Fax Service, Housekeeping, Laundry Facilities, Luggage Storage, Postal Service, Tours/Travel Desk, Bar, Mini-Supermarket, Minibar, Restaurant",8.0,8.0
6.0,Koh Phangan,8.0,Thailand,"This property is 2 minutes walk from the beach. First and Frang Hotel offers convenient accommodation located in Thongsala. Free WiFi is available in all rooms and private parking is available free of charge. Guests will also find a convenient store at the property. All air-conditioned rooms here feature a fridge, a minibar and free bottles of water. The en suite bathroom comes with either a shower or a bathtub. Service-minded staff are available for 24 hours at the front desk. Thongsala Walking Street is 1.5 km from First and Frang Hotel, while Thongsala Pier is 1.6 km away. This property is also rated for the best value in Thongsala! Guests are getting more for their money when compared to other properties in this city.  View House Rules  ",unknown,8.0,Hotel,8.0,First and Frang Hotel,US$2.32,7.7,Very Good,3,8.0,"Free City Maps, Free Internet Access, Free Parking, Free WiFi, Towels Included, Air Conditioning, Breakfast Not Included, Cable TV, Card Phones, Dry Cleaning, Dryer, Fridge/Freezer, Golf Course, Hair Dryers, Hot Showers, Iron / Ironing Board, Key Card Access, Meeting Rooms, Outdoor Terrace, Parking, Reading Light, Safe Deposit Box, 24 Hour Reception, Airport Transfers, ATM, Business Centre, Express check-in / out, Fax Service, Housekeeping, Internet Access, Late check-out, Laundry Facilities, Luggage Storage, Reception (limited hours), Tours/Travel Desk, Wake-up calls, Bar, Café, Mini-Supermarket, Minibar, Restaurant, Tea & Coffee Making Facilities, Nightclub, Wi-Fi",8.0,8.0
,Koh Phangan,,Thailand,"Welcome to Rosetel the destination of fullmoon party accommodation for backpackers, couples and everybody who want to have fun and great experience of Koh Phangan. Friendly Staff and clean rooms with shared bathroom come along with your stay. We always here to help you to explore the island and to give advice's about tours or your next travel destination. During every month, there are different events on the Island like Half moon party, Jungle experience, Fullmoon party or one of the weekly party where we hope you join us. Come to stay with us at center of Haad Rin where fullmoon beach is. We look forward to welcoming you soon. Things to note 1) Check in from 14:00 2) Check out Before 12:00 3) Reception working hours: 9:00 – 22:00 If you will arrive at the hostel after 22:00, please let us know in advance. 4) Payment on Arrival: Cash only. 5) Cancellation or amendment must be made 5 days in advance prior to arrival. 6) Breakfast is not included 7) NO smoking in Room, but have smoking area  View House Rules  ",unknown,,Hostel,,Rosetel,US$7.73,9.1,Superb,2,,"Free City Maps, Free Parking, Free WiFi, Linen Included, Towels Included, Air Conditioning, Wi-Fi",,
10.0,Koh Phangan,6.0,Thailand,"A 5-minute walk from the famous Full Moon Party Beach, Haad Rin, Seventeen Hostel offers cosy and comfortable accommodation with free Wi-Fi. Simply furnished rooms feature tiled floors. They come with air conditioning and shared bathroom facilities. Guests can hire cars and explore nearby places. Staff at the tour desk can help guests with sightseeing and travel arrangements. For convenience, luggage storage facility and laundry services are provided. A range of local restaurants are located within 200 metre away from the property. ***Property Policies & Conditions: 1. Check in from 1pm and check out until 12 noon. 2. Cash (THB) payment only upon arrival. 3. Cancellation policy: (1) At least 3 days advance notice before the arrival date is required. (2) If cancell later or in case of No-Show, the total amount wil be charged. 4. Your key deposit is non refundable, if you get paint on the bed sheets or pillow case and if you lose your locker or room key. 5. Please no outside guests after 9pm. 6. No smoking in the dorms. 7. Do not put any toilet paper in the toilets, it clogs the pipes. Throw the paper in the garbage bin. Thank you. 8. Please respect the staff and your bunk mates, no nudity and no sex in the dorms.  View House Rules  ",unknown,10.0,Hostel,10.0,Seventeen Hostel,US$23.18,8.9,Fabulous,41,8.0,"Free WiFi, Towels Included, Air Conditioning, Breakfast Not Included, Common Room, Hot Showers, Meeting Rooms, Safe Deposit Box, Security Lockers, 24 Hour Reception, 24 Hour Security, ATM, Towels for hire, Cafe, Meals Available, Foosball",8.0,10.0
7.5,Koh Phangan,6.5,Thailand,"Coral Bungalow Haad Rin Situated along the beachfront in Haad Rin. It offers an outdoor pool with regular pool parties and live music. Guests enjoy an all-day breakfast at the restaurant, which also serves local food, as well as free WiFi access in public areas. Drinks can be ordered at the bar and motorbike rental is available. The things that make us difference is, we like to get know our customers and provide a personal touch to their stay in Koh Phangan. At Coral we believe that friendly staff, affordable prices, good facilities and a great atmosphere has made your holiday at Coral Bungalows the unforgettable experience. At Coral Bungalows, guests have access to a fitness center. The tour desk can assist with excursions and water activities, as well as massage services. Laundry services are available for added comfort and free parking is offered. Facilities - Bike for rent, Swimming pool, Massage, Road trip, Travel agency, International Restaurant, Pool party with live DJ.  View House Rules  ",unknown,8.0,Bed and Breakfast,8.5,Coral Bungalows,US$3.09,7.8,Very Good,25,8.5,"Free City Maps, Free Parking, Free WiFi, Towels Included, Air Conditioning, Bicycle Parking, Breakfast Not Included, Cable TV, Card Phones, Ceiling Fan, Hot Showers, Outdoor Swimming Pool, Outdoor Terrace, Parking, Reading Light, Safe Deposit Box, Swimming Pool, Airport Transfers, Fax Service, Housekeeping, Internet Access, Late check-out, Laundry Facilities, Luggage Storage, Postal Service, Reception (limited hours), Tours/Travel Desk, Bar, Café, Meals Available, Restaurant, Tea & Coffee Making Facilities, Wi-Fi",8.0,7.5
6.7,Koh Phangan,6.0,Thailand,"Located just 2 minute walking distance from legendary full moon party , S & C Hostel is far enough from the beach to get a good nights sleep. S & C Hostel has air-conditioned dormitory rooms feature bunk beds with personal lockers . Guests have access to a shared toilet and bathroom with free toiletries and hot/cold shower. Laundry Service /Tour Desk/Transportation are available here. Please contact our Front Desk.  View House Rules  ",unknown,6.0,Hostel,8.0,S & C Hostel,US$12.36,6.6,Good,11,6.0,"Free Parking, Free WiFi, Towels Included, Air Conditioning, Hot Showers, Security Lockers, Fax Service, Laundry Facilities, Tours/Travel Desk, Tea & Coffee Making Facilities",7.3,6.0
,Koh Phangan,,Thailand,"Relaxing, electrifying and unparalleled experiences await you at the 4-stars Phangan Bayshore Resort in Koh Phangan, a stunning island in southeast Thailand, situated between the equally enticing destinations of Koh Samui and Koh Tao, both of which, due to the very easy and convenient transport links by boat, are must-sees during your unforgettable stay with us. This excellent beach resort boasts the best location in Koh Phangan, on the seafront of the gorgeous Haad Rin Nok beach, which is as beautiful as it is relaxing and like no other you have ever seen before… This first-class beach is, without a doubt, the most beautiful in the entire Thai Gulf, with stretches of fine white sand which feel like heaven when sinking your feet into and shallow water with no coral reef, meaning you can feel safe letting your children enjoy themselves.to the fullest, as you lie back, unwind in the glorious sunshine and feel all that built-up tension gently slip away. Property Terms & Policies: 1) Check in from 14:00 2) Check out Before 12:00 3) Reception working hours: 24 hours. 4) Payment on Arrival: Cash and credit card 5) Cancellation or amendment must be made 15 days in advance prior to arrival. 6) Breakfast is included. 7) NO smoking in Room, but have smoking area.  View House Rules  ",unknown,,Hotel,,Phangan Bayshore Resort,US$23.18,,No Rating,0,,"Free Breakfast, Free City Maps, Free Internet Access, Free Parking, Free WiFi, Linen Included, Towels Included, Adaptors, Air Conditioning, Cable TV, Children's Play Area, Dryer, Fitness Centre, Fridge/Freezer, Hot Showers, Outdoor Swimming Pool, Outdoor Terrace, Parking, Safe Deposit Box, 24 Hour Reception, 24 Hour Security, Airport Transfers, ATM, Housekeeping, Internet Access, Laundry Facilities, Luggage Storage, Room service (limited hours), Tours/Travel Desk, Wake-up calls, Bar, Minibar, Restaurant, Tea & Coffee Making Facilities, Wi-Fi",,
,Koh Phangan,,Thailand,"Located in Haad Rin, Phangan Mantra Resort offers beachfront accommodation 200 meters from Full Moon Party, Rin Beach. Our resort provides various facilities such as a shared lounge, terrace, tour desk and more.  Featuring a bar, the 1-star resort has air-conditioned rooms with free WiFi, each with a private bathroom.  The resort features family rooms.  Our hotels consist of 30 guestrooms with great amenities such as private bathroom, free WiFi, bidet and more.  We pro housekeeping and provide our guests with free parking, daily housekeeping and laundry service. Property Terms & Policies: 1) Check in from 14:00 2) Check out Before 12:00 3) Reception working hours: 24 hours. 4) Payment on Arrival: Cash only. 5) Cancellation or amendment must be made 7 days in advance prior to arrival. 6) Breakfast is not included. 7) NO smoking in Room, but have smoking area. 8) We only accept guests at the age of 18 years old or more.  View House Rules  ",unknown,,Hotel,,Phangan Mantra Resort,US$9.27,,No Rating,0,,"Free City Maps, Free Internet Access, Free Parking, Free WiFi, Linen Included, Towels Included, Air Conditioning, Breakfast Not Included, Ceiling Fan, Meeting Rooms, Parking, 24 Hour Reception, 24 Hour Security, ATM, Housekeeping, Internet Access, Late check-out, Laundry Facilities, Luggage Storage, Room Service  (24 hours), Tours/Travel Desk, Bar, Pool Table, Wi-Fi",,
,Koh Phangan,,Thailand,"Drink, Party, Sleep, Repeat! Asia Blue - The Tavern Hacienda is located in Koh Phangan. It features rooms with air conditioning. Free Wi-Fi access is available. Other facilities offered include an on-site bar. Our mission is quite simple: to make sure our guests are making the most out of their time here on this beautiful island. We provide the best in services from tours and travel to parties and good nights meeting new people. Run by backpackers for backpackers we do our best to accommodate for everyone and make the most of your stay here, so…want to come play with us? We have no minimum nights stay over Full Moon in low season, giving you full flexibility to make or change your plans at the drop of a hat! We can also help you pre party it up in style with games, body painting and drink specials!. Wanna go all out?! We have some fantastic FULL MOON PARTY PACKAGES you can upgrade to! Property Terms & Policies: 1) Check in from 14:00 2) Check out Before 10:30 3) Reception working hours: 9:00 – 21:00 4) Payment on Arrival: Cash and credit card Credit card payment will have 5% surcharge. 5) Cancellation or amendment must be made 7 days in advance prior to arrival. 6) Breakfast is not included 7) NO smoking in Room, but have smoking area. 8) We only accept guests at the age of 18 years old or more.  View House Rules  ",unknown,,Hostel,,Asia Blue - The Tavern Hacienda,US$4.64,,No Rating,0,,"Free Parking, Free WiFi, Linen Included, Air Conditioning, Hot Showers, Parking, Security Lockers, Bicycle Hire, Housekeeping, Luggage Storage, Reception (limited hours), Tours/Travel Desk, Bar, Cafe, Restaurant, Board Games, Pool Table, Wi-Fi",,
,Koh Phangan,,Thailand,"SK Home Guesthouse is situated in Koh Phangan. It features rooms with air conditioning and fan and other facilities offered. Free Wi-Fi access is available. Our location near the beach at about 310 meters, near to 7-11 and around, has many bars and restaurants, tattoo shops, ATM, Rent a car, and not far from  Samui island. You can walk for the day or night time is comfortable and friendly people. The beach is beautiful and not far from a full party.  The weather is nice many clothing shops for how to like shopping and likes to drinking, hang out. It would be best if you came to visit us, we hope you see all of the people come and stay and Koh Phangan we will welcome you guys. Property Terms & Policies: 1) Check in from 14:00 2) Check out Before 12:00 3) Reception working hours: 8:00 – 20:00 4) Payment on Arrival: Cash and credit card 5) Cancellation or amendment must be made 7 days in advance prior to arrival. 6) Breakfast is not included. 7) NO smoking in Room, but have smoking area. 8) Please note SOME rooms has not air-con only FAN. Please make sure before making a reservation.  View House Rules  ",unknown,,Bed and Breakfast,,SK Home Guesthouse,US$1.71,,No Rating,0,,"Free WiFi, Linen Included, Towels Included, Breakfast Not Included, Reading Light, Housekeeping, Luggage Storage, Reception (limited hours), Bar, Wi-Fi",,
,Koh Phangan,,Thailand,"Welcome to the home of the biggest & baddest party in Thailand. Come join the hundreds of thousands of people who have already slept with us and have the best nights of your life. With over 10,000 reviews and a 93% approval rating we are the highest rated party hostel group in the world! We will show you that we love you as much as everyone loves us! With locations across Thailand, Indonesia and more on the way, you're sure to find we can help you explore South East Asia from start to finish. Come join our family as we #AdventureHardPartyHarder. Slumber Party Hostels & Resort Koh Phangan Terms & Policies: 1) Check in from 14:00 2) Check out Before 12:00 3) Reception working hours: 9:00 – 23:00 4) Payment on Arrival: Cash only. 5) Cancellation or amendment must be made 2 days in advance prior to arrival. 6) Breakfast is not included. 7) NO smoking in Room, but have smoking area. 8) We only accept guests at the age of 18-35 years old.  View House Rules  ",unknown,,Hostel,,Slumber Party Hostels & Resort Koh Phangan,US$12.36,,No Rating,0,,"Free Internet Access, Free WiFi, Linen Included, Towels Included, Air Conditioning, Breakfast Not Included, Ceiling Fan, Common Room, Fitness Centre, Hot Showers, Outdoor Swimming Pool, Security Lockers, 24 Hour Security, Housekeeping, Internet Access, Laundry Facilities, Reception (limited hours), Tours/Travel Desk, Bar, Cafe, Restaurant",,
,Koh Phangan,,Thailand,"Phatchara Boutique Hotel offers convenient accommodation located in Thongsala. Free WiFi is available in all rooms and private parking is available free of charge. All air-conditioned rooms  Service-minded staff We are located on Koh Phangan, It features rooms with free WiFi and comfortable rooms with a balcony. The hotel is  1.3 km from Thongsala Pier. Complete with air conditioning, all the cozy rooms come with wooden furniture, a flat-screen cable TV and an fridge. The private bathroom includes a shower and free toiletries. Facilities include: - Private Rooms  for singles, friends, or couples - At the reception we can help you book or hire: motorbikes, local tours, party tickets,  taxis, boat trips, laundry & towels, cooking classes, kitesurfing, ferry tickets, and other adventures! Property Policies & Conditions: 1. Check-in Time: from 2pm, if you are early you can store your bags and enjoy at swimming pool 2. Check-out Time: until 11:00am. 3. Payment: Cash (THB) only upon arrival. 4. Cancellation Policy: Up to 7 days advance notice before the arrival date is required. 5. Reception Hours: Main reception (Bikes, tours, ferries etc) 8am to 9pm. 6. Breakfast is not included. 7. The property including the pool is open to the public at the discretion of management. Outside visitors are not allowed in the hostel rooms, they are for customers only. 8. We require a 1000 baht damages deposit on arrival per booking  View House Rules  ",unknown,,Hotel,,Phatchara Boutique Hotel,US$10.66,,,0,,"Free Internet Access, Free Parking, Free WiFi, Linen Included, Towels Included, Adaptors, Air Conditioning, Breakfast Not Included, Hot Showers, Outdoor Swimming Pool, Outdoor Terrace, Parking, Swimming Pool, Housekeeping, Late check-out, Laundry Facilities, Reception (limited hours), Tours/Travel Desk, Wi-Fi",,
8.0,Koh Phangan,7.0,Thailand,"Our sister hostel, Wild & Wandering, was approached by organizers saying there was NO LGBTQ presence at Full Moon Party, so they started hosting a gay meetup at their famous Pink Bar! After so much positive feedback, we launched OUT Hostel - a friendly place for LGBTQ & Allies to meet & stay for Full Moon Party! On a back street in the CENTER of Haad Rin Town (Full Moon Zone), we are perfectly located to party hard all night & still get some sleep! We are part of the growing Backpacker Social Experience Group network of small businesses that treat travelers more like friends & families than customers & ATMs! Friendly, Comfortable, Clean, Good value & Eco-Conscious - all our partners work hard to give you the most casual, social, fun & enjoyable experience for Full Moon Party & Haad Rin! If you need ANYTHING, let us know - we can help! We hope you'll join all our partners for huge pre-parties for Jungle Experience, Full Moon Party & many others throughout the month @ our Pink Bar! ***PLEASE NOTE*** FOR REFUNDABLE BOOKINGS, 50% DEPOSIT REQUIRED AT THE TIME OF BOOKING. FOR NON-REFUNDABLE BOOKINGS, 100% DEPOSIT REQUIRED AT THE TIME OF BOOKING. IF DEPOSIT IS NOT RECEIVED, HOSTEL RESERVES THE RIGHT TO RESELL YOUR BEDS WITH NO OBLIGATION TO ACCOMMODATE YOU Refundable if cancelled outside 7 days. Full amount is Non-refundable if cancelled within 7 days. One night ADDITIONAL penalty will be charged in case of no-show. Your card may be preauthorized for total stay cost to protect against fraud and no-shows. Non-refundable bookings may be charged in full if payment isn't received within one week (24 hours for bookings within a week of arrival date). These charges may appear on your statement as 'Pangea Phangan/Samui', our parent company. Things to note 1) Check in from 14:00 2) Check out Before 11:00 3) Reception working hours: 11:00 – 21:00. Please let us know in advance if you will check-in after 21:00. 4) Payment on Arrival: Cash (Payment in advance by credit card, PayPal, Bank Transfer, Bitcoin) 5) Cancellation or amendment must be made 7 days in advance prior to arrival. 6) Breakfast is not included 7) NO smoking in Room, but have smoking area 8) We only accept guests 18 years or older. WE ARE LOOKING FORWARD TO SEEING YOU IN HAAD RIN!! :)  View House Rules  ",unknown,6.0,Hostel,9.0,Out! Hostel & Bar,US$4.91,7.6,Very Good,6,6.0,"Free Internet Access, Free Parking, Free WiFi, Linen Included, Towels Included, Air Conditioning, Bicycle Parking, Breakfast Not Included, Common Room, Hot Showers, Outdoor Terrace, Parking, Security Lockers, 24 Hour Reception, Bicycle Hire, Express check-in / out, Housekeeping, Internet Access, Late check-out, Luggage Storage, Tours/Travel Desk, Bar, Nightclub, Wi-Fi",9.0,8.0
,Koh Phangan,,Thailand,"C Villas is located on the beautiful sunset beach beach. It is only 15 mins walk to the world famous fullmoon party beach. Moreover, the hostel is a 10-minute ride from Haad Rin Pier, and Thong Sala Pier is a 25-minute drive away. *****BREAKFAST SET INCLUDED***** (Scrambled Eggs + Bacons + Toast + Tea of Coffee) C Villa features stylish accommodations with modern facilities. This hostel has an amazing infinity swimming pool with a great view of the ocean. All the guestrooms come with air conditioner. Complimentary wireless Internet access is available to keep you connected. In addition to this, there is a restaurant in the hostel. ***Property Policies & Conditions: 1. Check-in Time: 2:00pm 2. Check-out Time: 11:00am 3. Both cash and credit card (Visa, Master Card) are accepted upon arrival. - 3% will be charged for using credit card at the hotel. - Full payment is required on arrival. 4. Prepayment: (1) For busy period such as full moon parties and New year's eve, please pay by Paypal or Credit Card as soon as you book the room. (2) For the private rooms a full payment is required as soon as you book the room in order to secure your booking. (3) If we do not receive the full payment by 3 days after your booking date we can cancel your reservation and re-sell the beds. 5. Cancellation policy: (1) Cancellation must be made at least 14 days prior to 12pm of your arrival day. Otherwise, the whole stay fee will be charged. (2) During full moon parties and New year's eve, 30 days advance notice before the arrival date is required. 6. The reception is open from 8:00am to 10:00pm. - If the guests have any special check in or check out time, please inform the property in advance for arrangement. 7. Please note no one is allowed to bring people back to the room if they have not booked a bed already. 8. Please be considerate of your fellow roommates and respect each others stuff and privacy.  View House Rules  ",unknown,,Hostel,,C Villas,US$10.82,,No Rating,147,,"Free City Maps, Free Parking, Free WiFi, Towels Included, Air Conditioning, Hair Dryers For Hire, Hot Showers, Outdoor Swimming Pool, Reading Light, Swimming Pool, Reception (limited hours), Tours/Travel Desk, Restaurant, Pool Table, Wi-Fi",,
4.5,Koh Phangan,6.5,Thailand,"We have two clean and spacious air conditioned dorm rooms with nice floors, hot showers and private balconies equipped with seating that overlooks the town- free wifi, located In the Perfect location for the full moon party! Each dorm room has lockers available with locks for a 300bht key deposit, plenty of electrical outlets for recharging electronics, and reading lights for some of the beds. The 22 bed dorm has 2 en suit showers and a separate sink area. The 14 bed dorm has 4 bathrooms and 2 showers down the hall with a separate sink area as well.  Downstairs there is a lounge with a large couch, a tv, and a computer equipped with skype. Wifi is free but we charge 60thb per hour for  use of the computer. There is 24 hour reception and and a security camera for your safety. Check in is at 12pm as well as check out.  View House Rules  ",unknown,5.0,Hostel,10.0,Lucky Hostel Koh Phangan,US$15.45,6.5,Good,95,6.5,"Free City Maps, Free WiFi, Air Conditioning, Cable TV, Ceiling Fan, Common Room, Hot Showers, Outdoor Terrace, Reading Light, Security Lockers, 24 Hour Reception, 24 Hour Security, Housekeeping, Internet Access, Tours/Travel Desk, Towels for hire, Tea & Coffee Making Facilities",7.0,6.0
